weather_id,date_time,city,season,temperature_c,humidity,rain_mm,wind_speed_kmh,visibility_m,weather_condition,air_pressure_hpa
1.0,2099-13-40 25:61,London,Autumn,45.313069216818825,134.0,21.036696013874373,55.21754288483454,4463.0,Rain,985.4723824053646
2.0,2099-13-40 25:61,,Summer,10.885474383393888,68.0,21.329619555626508,26.97664631067117,2320.0,Rain,1025.2280377044808
3.0,2099-13-40 25:61,,,-29.028857581995954,74.0,16.679953888984752,43.66183556466802,8093.0,Storm,950.1827794479668
4.0,2024-01-01T03:00Z,London,Winter,25.904206786406448,97.0,23.53453616799681,36.395418081021035,4354.0,,988.8150579313077
5.0,01/01/2024 04AM,,Summer,15.360175387419511,91.0,146.85001933389518,24.270451930402686,4666.0,Rain,951.177325652007
6.0,,London,Spring,32.773258872304886,58.0,19.310182995399387,28.15404143913721,7576.0,Snow,1045.4395299178464
7.0,Unknown,London,Autumn,26.514045071812134,27.0,70.30729944312174,2.84416153205302,9433.0,Snow,967.1815458746971
8.0,2024-01-01T07:00Z,,Spring,17.661852337968625,59.0,9.826940984851175,78.79356096056705,1508.0,Clear,1033.5593981154113
9.0,2024-01-01 08:00,,Winter,12.073336813148734,50.0,26.247983827150698,62.38899356438138,2597.0,Snow,956.0315028686769
10.0,2024-01-01T09:00Z,London,Winter,8.638003017996846,18.0,110.95099280955392,45.05554320206376,6285.0,Fog,963.5638890355584
11.0,2024-01-01 10:00,,Winter,9.43021336624416,92.0,24.42574837223307,68.34573065940612,7919.0,Clear,960.1218602453667
12.0,01/01/2024 11AM,London,,22.68509511956472,26.0,20.476537256176158,6.12699017626416,4301.0,Storm,976.1845801788126
13.0,2024-01-01 12:00,,Spring,59.419434041395405,30.0,5.303242727115736,33.04329922787136,,Storm,1012.2610061985223
14.0,2024-01-01 13:00,,Autumn,22.742313358023548,98.0,20.08827958345516,71.94431116284386,6463.0,Storm,1038.0669286252491
15.0,01/01/2024 02PM,London,Autumn,10.180160170041713,,104.64733989881478,78.49547916721244,9372.0,Storm,1001.7846776530838
16.0,2099-13-40 25:61,,Summer,2.6996268642660226,,8.715776949239375,21.89481829533981,7922.0,Clear,993.0785673788743
17.0,01/01/2024 04PM,London,Spring,18.340008641977683,51.0,20.32221070866373,214.0790161695774,6425.0,Snow,986.481575307595
18.0,Unknown,London,,25.16527842178793,64.0,29.396318784944622,30.419015554587574,21036.0,Storm,965.6782680441696
19.0,2024-01-01T18:00Z,London,Spring,22.665934881573587,79.0,16.89872733043202,36.38643220285354,9393.0,,952.0108987226528
,Unknown,London,Spring,30.457059059632925,54.0,12.728065073877836,242.6847664058752,9514.0,Snow,1005.6425088229529
21.0,2024-01-01T20:00Z,,Summer,-1.2953871826544407,75.0,16.57536355926698,76.9748414340838,8724.0,Clear,998.8071144964805
22.0,Unknown,London,Winter,20.954645322869233,91.0,8.8307800872839,58.29595420864068,2011.0,Storm,991.8660140924837
23.0,01/01/2024 10PM,,,14.404503352878429,26.0,6.322312577120846,14.745963242434543,1215.0,,1036.1486576308475
24.0,01/01/2024 11PM,,Summer,58.98207720171429,47.0,15.28596838767659,44.44973585882142,4429.0,Rain,954.4663888587768
25.0,2099-13-40 25:61,London,Autumn,16.554258600058777,28.0,18.981004273341934,31.141293757360238,3920.0,Fog,1027.4216015974214
26.0,2099-13-40 25:61,,Winter,23.326474095340163,72.0,24.650580344647825,12.340447260103078,7093.0,Snow,
27.0,2024-01-02T02:00Z,London,Winter,26.101212031140765,76.0,19.25819775700053,50.32575268524201,1607.0,Storm,1011.6074049864479
28.0,2024-01-02T03:00Z,,Autumn,14.08558060958085,84.0,1.5360956782799229,41.02436552359583,3371.0,Storm,981.0025759760266
29.0,2099-13-40 25:61,London,Winter,25.6566496842295,47.0,27.020882098735708,75.20385877760364,3914.0,,960.1373796018727
30.0,2099-13-40 25:61,,,32.1066072902034,86.0,23.603529302096,161.80817995617036,4659.0,Snow,
31.0,Unknown,London,Winter,-0.11591046738819344,83.0,11.390860019537023,35.470366282022155,7606.0,Rain,1024.6639721259949
32.0,Unknown,London,Summer,8.225468836623637,47.0,16.498701116568398,65.7842968779272,582.0,Fog,1031.9869820625615
33.0,2099-13-40 25:61,,Winter,13.537877594532015,,133.7126927873415,75.24322425712623,9027.0,Snow,996.8084172619937
34.0,02/01/2024 09AM,London,Winter,20.511826598105444,57.0,20.804711665730515,14.60612647864954,36809.0,Storm,
35.0,Unknown,London,Winter,9.926129242827061,62.0,16.18256387400737,63.28781646360318,1732.0,Snow,1047.1573803952692
36.0,2099-13-40 25:61,,Winter,23.49033712734247,79.0,23.215023019161542,9.819070460944506,195.0,Rain,985.5555656390364
37.0,2099-13-40 25:61,,Summer,13.247173299281153,81.0,28.664965908212924,72.31925233002384,1401.0,Fog,991.1535781246743
38.0,2024-01-02 13:00,London,Autumn,9.45495218775157,93.0,22.441927094429573,44.18755058790467,3973.0,Fog,968.611151888846
39.0,Unknown,London,Autumn,28.81709962617822,88.0,3.2965609287565867,9.044209892635138,8261.0,,1041.659940681426
40.0,2099-13-40 25:61,London,Summer,-1.5813946887961023,,21.96363155148201,79.69183836988749,,Snow,1049.7512653068925
41.0,2024-01-02T16:00Z,London,Spring,21.659564221929173,,6.292189112891084,73.97706559951547,43689.0,Rain,972.540658381861
42.0,02/01/2024 05PM,,Autumn,14.322586698624137,32.0,140.20949199819893,78.23539507042267,3110.0,Fog,1016.2359282503256
43.0,2024-01-02T18:00Z,,,8.867873643714589,58.0,19.557741684106734,39.53556510152451,8600.0,Fog,1021.1143424282151
44.0,Unknown,London,,10.158369706315533,93.0,25.3152385643574,57.05743910517071,5091.0,,1043.777324963533
45.0,2024-01-02T20:00Z,,Summer,43.78024895916365,27.0,19.41378520264937,35.98798940355698,2983.0,Storm,1004.3856402756859
46.0,2024-01-02 21:00,London,Spring,22.211058025602966,38.0,29.57579688014973,77.08707482397516,22724.0,Snow,
47.0,02/01/2024 10PM,,Spring,21.301604972361407,42.0,8.876049658267346,11.472047147944435,41724.0,Snow,1038.7313123738643
48.0,2099-13-40 25:61,London,Summer,21.392527363839232,30.0,12.726932672738798,4.128118677088155,2216.0,,995.2759552834002
49.0,Unknown,London,Summer,-28.941146877228178,30.0,24.895615699500574,58.77901771589305,8977.0,Clear,1029.8512293917686
50.0,2024-01-03T01:00Z,London,Winter,9.705826838369337,65.0,27.98129239342423,21.990090420664927,1909.0,Rain,1004.4353986740995
,03/01/2024 02AM,,Autumn,11.99509007848803,39.0,13.670386563712404,77.09878748610214,6192.0,,996.0066057148193
52.0,Unknown,London,Spring,20.790388217075883,36.0,14.413253592024018,70.85581467079066,40929.0,Fog,1037.570295703929
53.0,2099-13-40 25:61,,,57.614121109475704,93.0,8.924917036591637,75.81775904408786,7634.0,Clear,
54.0,2024-01-03 05:00,,,9.672893574913424,84.0,12.778968489661063,40.23694397521278,9104.0,Clear,1016.3209462000766
55.0,2024-01-03T06:00Z,London,,9.671983910039035,46.0,26.252298923630917,56.3260299421838,3010.0,Storm,1035.1721598410882
56.0,2024-01-03T07:00Z,,Autumn,7.569041644723019,67.0,25.10306320365926,38.091222911519,9880.0,Rain,1035.7074001550102
57.0,2024-01-03T08:00Z,London,Winter,14.867286102083272,80.0,0.6070970766866923,25.270466465749486,926.0,Rain,966.6629888983117
58.0,2024-01-03T09:00Z,,Autumn,13.087029230608367,79.0,7.335425714064875,143.14497799034996,4107.0,Rain,961.9454096855346
,Unknown,,Summer,17.335584429915862,22.0,27.515980533324104,43.48393685166778,21929.0,Storm,1004.6882995433084
60.0,2099-13-40 25:61,,Spring,14.374369120048708,37.0,22.76593548067753,48.33236130441827,7458.0,Fog,973.9611433284545
61.0,03/01/2024 12PM,,Winter,29.16025909725446,81.0,11.90611736973683,56.41599835038509,,Snow,978.5400165454585
62.0,2024-01-03 13:00,London,Autumn,21.330733083850333,96.0,1.6054957178659357,22.982042163304577,32581.0,,982.8666208552546
63.0,Unknown,London,Spring,7.895669574243177,81.0,24.764419473540798,6.383679793091224,27938.0,Storm,1025.3854512706293
64.0,Unknown,,Winter,,65.0,26.158015210308264,48.9299332927893,8035.0,,1041.5003340789656
65.0,2024-01-03T16:00Z,London,Autumn,8.061142233041652,80.0,19.59186478560623,51.2420994512306,784.0,,956.4865657396751
66.0,2099-13-40 25:61,London,,3.3990130637869953,33.0,22.071073009363147,21.034519593098988,5618.0,Snow,999.8444742761934
67.0,2024-01-03 18:00,London,Spring,-18.248894336440543,22.0,6.01451472350807,54.36859767122311,46926.0,Clear,1001.4410110194059
68.0,03/01/2024 07PM,London,Summer,-6.645407741813646,25.0,15.358278393961701,75.33269692778688,26998.0,Rain,950.277971742023
69.0,2024-01-03T20:00Z,,Spring,13.743692864662934,69.0,21.514297722545837,74.96873026353465,5036.0,Fog,1046.1535339852353
70.0,2024-01-03 21:00,,Summer,5.410179313208452,57.0,24.520020169895744,61.93563375292166,1816.0,Fog,1044.4857786252526
71.0,2024-01-03 22:00,,Autumn,2.6207839299114415,92.0,29.450685676090075,28.603497606417257,1833.0,Fog,972.4999182543947
72.0,2024-01-03 23:00,,Summer,17.247437001502355,41.0,23.342297536009944,37.90679080729117,4914.0,Snow,1038.3025643934564
73.0,Unknown,London,Spring,13.172292494357634,43.0,14.115622643934522,35.77770305520691,1193.0,Snow,1042.9870713680132
74.0,2024-01-04 01:00,London,Winter,18.20537362624403,44.0,23.29326988887483,32.49422500688976,2441.0,Rain,1043.266264735609
75.0,04/01/2024 02AM,,Autumn,28.87762023078617,56.0,18.92618366790927,62.5288238413766,795.0,Clear,984.7427048552942
76.0,2099-13-40 25:61,London,Winter,15.715860007849017,77.0,1.588726178531642,40.903842921600756,3690.0,Rain,963.0870266901912
77.0,2099-13-40 25:61,,Spring,15.447562946514797,68.0,7.783241513903908,,7905.0,,1039.738393057581
78.0,2024-01-04T05:00Z,London,,29.242848003847776,91.0,27.0179253286189,27.39012212265232,634.0,,997.6549530845076
79.0,Unknown,,Autumn,9.976949201400977,24.0,2.503686198656181,,7072.0,Rain,1031.824879628496
80.0,2099-13-40 25:61,London,Winter,1.588346489212574,58.0,137.77597730707004,70.69858004604305,3749.0,Rain,1036.2379863214787
81.0,2024-01-04 08:00,London,,13.684083586191528,83.0,9.442322631581847,29.54524972001267,4830.0,Clear,1000.7412864409005
82.0,2024-01-04 09:00,London,Autumn,15.01473838068165,79.0,24.780295195989645,47.81144129214159,6009.0,Storm,997.5063024104286
83.0,2024-01-04 10:00,London,Spring,6.347942349482841,72.0,16.63078471862871,18.3362236465047,7489.0,Snow,980.1837835859076
84.0,Unknown,London,Winter,28.934550433261265,49.0,11.83463506129967,12.558220284269925,6258.0,Fog,1002.8044870482765
85.0,2024-01-04 12:00,London,,24.18055415356075,63.0,19.29603913719586,23.58134467263217,2926.0,Clear,980.8876652564586
86.0,04/01/2024 01PM,,,12.036250338846664,120.0,3.870337541656539,12.947132768170357,1071.0,Rain,988.0046248591442
87.0,2024-01-04 14:00,London,Autumn,,18.0,29.214694019495116,66.20823197966753,37910.0,Storm,959.6968919960317
88.0,2024-01-04T15:00Z,London,Autumn,21.61078674400797,58.0,26.41003392454766,56.97231304173059,3822.0,Rain,1012.1894465262176
89.0,2024-01-04 16:00,London,Autumn,6.859736923019669,63.0,26.023423600074494,33.40839218039694,6738.0,Rain,1022.623870340596
90.0,Unknown,,Winter,17.675399755617246,33.0,8.325968950465892,65.93047567407548,45705.0,Storm,999.7622948593346
91.0,2099-13-40 25:61,,Summer,10.242602530614533,49.0,0.4950796937067725,61.703626960419356,29229.0,Rain,1023.9302242375577
92.0,2024-01-04T19:00Z,,Autumn,19.95377020184444,89.0,9.501131818195095,165.54418001299825,1051.0,Rain,966.9513914212148
93.0,2024-01-04 20:00,,Summer,16.7309918577572,62.0,4.9132658352972,63.903303117199826,3495.0,Snow,1025.8290101415068
94.0,Unknown,,Summer,19.216969635579666,99.0,99.8963155899965,24.418814159183178,7744.0,Rain,968.3320509607845
95.0,Unknown,,Autumn,,54.0,1.7731769222653593,45.78060202014032,4551.0,Snow,978.137571613555
96.0,2024-01-04 23:00,London,Spring,9.80134012663887,36.0,10.32983290971377,38.76062242127781,3794.0,Clear,1026.334002853566
97.0,2024-01-05 00:00,,,14.425506005564678,87.0,3.678279643614556,44.38524083893036,25803.0,Snow,1037.478844804019
98.0,2024-01-05 01:00,London,Winter,19.373999168586632,71.0,8.908253591379381,136.06645537682425,,Snow,1018.9534361335551
99.0,2099-13-40 25:61,,,5.611814454229375,42.0,7.7332461976247115,55.976930092417696,,Snow,983.0780417875144
100.0,Unknown,,Winter,-13.81075845127556,22.0,17.085139829988847,72.53507181783671,8600.0,Snow,1033.1493899011261
101.0,2099-13-40 25:61,,,10.520650268911588,56.0,16.86093778686461,207.13708500000644,6257.0,Clear,1005.2131759377152
102.0,2024-01-05 05:00,,Summer,7.543797036024908,81.0,137.89474613041017,23.52484181950171,8334.0,Snow,1003.7897654260531
103.0,2024-01-05T06:00Z,,Autumn,59.1275860029198,101.0,,78.50810224498822,2147.0,Clear,965.3547418408227
104.0,2024-01-05 07:00,,Autumn,54.66504309742143,63.0,27.529557598780627,214.21830004613133,27308.0,Snow,964.0538574335311
105.0,05/01/2024 08AM,London,Spring,16.86987395251812,90.0,29.53442922701131,28.699968787701575,5325.0,Clear,978.6917669007748
106.0,2024-01-05 09:00,,Winter,9.84368456685377,39.0,9.02004048700762,35.192998425604465,32779.0,,1033.7141537337925
107.0,2024-01-05 10:00,London,Winter,11.152746787004714,48.0,28.872535856874165,7.95909567399919,4796.0,Storm,968.0246719697495
108.0,2024-01-05T11:00Z,London,,19.179948987515267,97.0,24.081891357451767,42.26721797038411,3988.0,,1027.8868066094274
,2024-01-05T12:00Z,London,Winter,5.432483379464086,84.0,28.421018878462885,23.57812896766039,9421.0,,1019.1290739839397
110.0,2099-13-40 25:61,,Autumn,3.3089621241890477,70.0,13.705593475511014,176.57300290767506,5694.0,Rain,991.5850689902934
111.0,05/01/2024 02PM,London,Autumn,-23.2522557465736,44.0,82.94269262723063,50.916275382264324,9709.0,Snow,961.8287996229348
,2024-01-05T15:00Z,London,Summer,-13.634259448250386,97.0,29.966176090230814,58.33759558210638,2767.0,Storm,997.2560425419639
113.0,2099-13-40 25:61,London,Winter,14.575501027602668,62.0,16.60092383644334,30.65269216823929,9007.0,Snow,1035.5538223131284
114.0,2099-13-40 25:61,,Summer,20.18744700297866,45.0,0.1366672923584944,17.662591053143977,4291.0,,991.7315188818823
115.0,2099-13-40 25:61,,Summer,5.211021896949367,52.0,29.950476768970802,16.16625758780362,6559.0,,1020.4213419428859
116.0,2099-13-40 25:61,London,Autumn,10.942996466456341,60.0,22.110321437538325,13.422462475514845,5960.0,Storm,965.9925409700455
117.0,2099-13-40 25:61,,,32.58421231354126,64.0,6.128037834578705,207.2024821836369,2864.0,Fog,962.4585017083448
,Unknown,,Spring,7.375373530710818,82.0,11.851694241476023,44.361971507190354,1774.0,Clear,978.3807491070892
119.0,05/01/2024 10PM,,Spring,7.1245681194797,41.0,24.929931458719018,2.9644574756675013,6540.0,Clear,964.0956812548994
120.0,2099-13-40 25:61,,Summer,17.935812955582293,65.0,0.7944876679952817,9.421233915860823,4937.0,Clear,954.1968120678697
121.0,Unknown,London,Summer,7.915579647839131,69.0,,65.73549215970351,7542.0,Storm,975.5192762395263
122.0,2024-01-06 01:00,,,28.403999702087763,71.0,12.581021247588446,56.75620903681448,3160.0,,1038.1331705520815
123.0,2024-01-06T02:00Z,London,Spring,16.342187172986065,47.0,14.538862167561552,,1696.0,,1034.8269747037227
124.0,06/01/2024 03AM,London,Winter,18.312645192569814,50.0,25.80641979492027,11.272748217733755,9765.0,,955.2918717439043
125.0,Unknown,London,Winter,29.8254155853407,20.0,11.78133529848692,71.73906265178528,5894.0,Storm,952.3062708641336
126.0,2099-13-40 25:61,,Autumn,11.688812011180305,,21.227143328836938,167.04079062182416,,Clear,1017.9287424445477
127.0,2099-13-40 25:61,London,Autumn,11.544907451606177,144.0,16.25279545842706,159.95223056822954,9075.0,Storm,998.6663651316438
128.0,2024-01-06T07:00Z,London,Autumn,26.88734733175569,81.0,7.98553981984242,61.26579181100212,422.0,,1025.3303379196054
129.0,2099-13-40 25:61,,Winter,19.77816144016655,85.0,8.41826504116103,21.003721105590955,6245.0,,1007.2495374978697
130.0,Unknown,,Autumn,24.210342341854506,94.0,10.821515802268951,8.457076833492883,4006.0,Snow,1045.9609160299751
131.0,06/01/2024 10AM,London,Winter,11.18795423407899,,6.426526721352419,52.11181562072737,6557.0,Rain,1004.4783962327222
132.0,2024-01-06 11:00,,Spring,,94.0,9.303183606143953,6.251218848199356,3947.0,Storm,1036.0231939498537
133.0,2024-01-06 12:00,London,Summer,18.86724710085106,83.0,8.060121675420344,24.92482351151951,2262.0,Snow,975.4417151855716
134.0,Unknown,,Summer,12.27621435530025,47.0,0.05198486021035231,2.0786210649254855,8103.0,Fog,1014.2371144314465
135.0,06/01/2024 02PM,London,Spring,5.013290702616887,99.0,26.539753436096184,30.433680673157227,7665.0,Rain,1020.3532166881478
,Unknown,London,Spring,-7.391578783949026,69.0,7.200964098760415,38.37521072870062,7260.0,Rain,1043.7295026600605
137.0,Unknown,,Summer,12.457671180989323,50.0,21.537222559231104,50.457013562634536,6208.0,,955.8315221353055
138.0,Unknown,London,Autumn,12.328015667417926,41.0,23.210899037856198,9.874032903268528,7582.0,Fog,990.5597631908367
139.0,2024-01-06T18:00Z,London,,19.298272691996935,20.0,63.39324359513557,16.7018232033832,3658.0,Fog,1036.0145925523761
140.0,2099-13-40 25:61,London,Summer,-0.42836573269142164,63.0,26.256378755549584,201.4282847010624,8712.0,Rain,980.6611943181789
141.0,Unknown,London,Summer,-0.8259361022890221,72.0,,70.102205811999,7827.0,,1006.0224334118385
142.0,2024-01-06 21:00,London,Spring,14.096248854970082,86.0,9.491406251475697,,,Storm,1024.5350574588226
143.0,2099-13-40 25:61,London,Summer,,90.0,25.17995730095773,206.170848491956,8482.0,Snow,972.8092602114068
144.0,2024-01-06T23:00Z,London,Spring,13.234901118968905,53.0,10.832390970540006,11.771009674482666,6873.0,Clear,1003.6898921551641
145.0,2024-01-07 00:00,London,Summer,-21.246435637765906,66.0,9.55506625585085,44.83593267915559,2317.0,Rain,1007.0608985946761
146.0,07/01/2024 01AM,London,Autumn,15.9824745699387,27.0,6.548064559326546,21.44335939769568,7280.0,Storm,1005.9333635419661
147.0,2099-13-40 25:61,,Winter,19.52815759304839,26.0,24.19860592173598,70.59432476777035,8176.0,Storm,1008.9395463457595
148.0,2024-01-07T03:00Z,,,49.07062251709066,64.0,27.46204815996964,230.08768650222655,3035.0,Clear,1039.6062761555856
149.0,Unknown,,,21.329767811416204,30.0,5.366968991694535,64.04487944103535,3276.0,Storm,1014.6519031035107
150.0,07/01/2024 05AM,London,Autumn,17.02178654078814,2.0,27.933866525799857,69.93533400566184,,,1007.1660629622932
151.0,Unknown,,Winter,6.783090429455841,37.0,9.04162613439301,1.0755699217305015,7492.0,Fog,952.1563862035557
152.0,Unknown,,Winter,11.582483590182218,33.0,17.263179995458717,72.20453414258667,2548.0,,1023.3435685980452
153.0,2024-01-07T08:00Z,,Summer,16.9076515317956,89.0,3.57881612778727,58.23549989567663,,Snow,958.4097092050104
,2024-01-07 09:00,London,Autumn,22.776277069795913,45.0,5.216272635100444,33.547168978088486,7943.0,Storm,1013.3143200529793
155.0,2024-01-07 10:00,London,Spring,10.575501300899035,21.0,19.18469864594093,,7349.0,Clear,967.6743490733833
156.0,2024-01-07 11:00,London,,6.51952531131097,78.0,61.08065247552459,31.96085357615507,1684.0,Clear,991.8449469037645
157.0,07/01/2024 12PM,London,Spring,19.652732425967727,62.0,13.577180170663143,17.817377143948157,5765.0,Storm,951.1581600078958
158.0,Unknown,London,,14.156076459035386,43.0,13.360901266968277,14.956453885435277,8240.0,Fog,1010.0291620554692
159.0,2024-01-07T14:00Z,London,Autumn,23.846747835552073,42.0,3.1776653743549566,41.25777341788097,5181.0,Storm,993.9869475079114
160.0,Unknown,,Autumn,16.959014393364985,32.0,17.7173860704408,18.911913736624577,3815.0,,1045.6009449270482
161.0,07/01/2024 04PM,,Autumn,4.423290493818431,29.0,2.5442763105911537,37.87346565956773,6372.0,,1032.025193891384
162.0,07/01/2024 05PM,,Spring,20.194738515832878,67.0,22.41282439518826,6.316883705373968,7261.0,Snow,1032.8166199510574
163.0,07/01/2024 06PM,,,4.079639237592705,42.0,5.9840502425583075,72.34279138926537,1058.0,Clear,996.5269937138567
164.0,2024-01-07T19:00Z,,Summer,20.861306423910086,53.0,17.15600711701128,8.380110852158351,4325.0,,1012.6486403382252
165.0,2024-01-07 20:00,London,Summer,15.863838821948434,59.0,29.54414926932945,17.152191024906145,4886.0,,
166.0,Unknown,London,Winter,21.652230090139547,55.0,20.248048210817355,11.232488909838185,1161.0,Fog,1009.0822951765773
167.0,2099-13-40 25:61,,Summer,22.60927371219188,133.0,83.34619726554172,0.3858981396507932,5066.0,,1038.8100319493428
168.0,2024-01-07T23:00Z,,Spring,10.964266168007509,59.0,11.600869771815068,37.48973679069279,,Clear,966.3306968286879
169.0,2024-01-08 00:00,,Summer,18.98056682963516,44.0,25.525427952989354,,9635.0,Rain,1010.3610357832634
170.0,,London,,3.8299233047935246,71.0,1.5190099509044963,17.203949519178614,7758.0,,1017.1374155613644
171.0,,,Summer,-2.6381984212750638,96.0,116.91916217829285,47.76073991110213,2578.0,Rain,989.0465557324633
172.0,08/01/2024 03AM,London,Spring,31.13117848924453,73.0,19.993321656297006,75.43220228843565,5852.0,,1029.9381021317872
173.0,2024-01-08T04:00Z,London,Summer,8.484844034868676,39.0,7.385091100864249,198.50737998039483,28072.0,Fog,1032.125544110982
174.0,2024-01-08T05:00Z,,Summer,53.40444709515553,44.0,29.85130320729904,5.000582721976761,6440.0,,1040.8798716858187
175.0,2024-01-08 06:00,,Autumn,12.572444971758149,,15.66019926140038,42.86499445131046,759.0,,966.1802339275331
176.0,2024-01-08 07:00,London,Summer,20.465566736803392,64.0,21.428643107857503,69.6762448451843,1936.0,Storm,1044.1745217479324
177.0,Unknown,,Spring,-24.108888351969252,32.0,22.87434256732024,116.62169814717419,4018.0,Storm,1031.1498944948212
178.0,2099-13-40 25:61,,Spring,-1.020416260528009,51.0,0.09059106542217976,74.49241581387119,5936.0,Rain,964.256654032288
179.0,2099-13-40 25:61,London,Summer,12.122223237489072,29.0,22.820457457905412,2.985269217153279,3311.0,,1044.874413193749
180.0,2024-01-08 11:00,London,Summer,28.555090460738985,41.0,101.14091610615947,41.852563385111125,6591.0,Snow,1020.7591152670443
,2024-01-08T12:00Z,London,Spring,19.329578539339124,91.0,11.387673762546227,68.56066926217923,7124.0,Snow,1007.6475175028627
182.0,2024-01-08 13:00,London,Summer,22.963955364859096,68.0,91.95280775003936,48.91006553019827,,Snow,1039.6254782097603
183.0,08/01/2024 02PM,,Autumn,8.722294261659963,42.0,80.11726515389806,158.69081168276045,2324.0,Rain,970.4365981627682
184.0,2024-01-08T15:00Z,London,Autumn,7.474769247812384,65.0,12.342910069420602,27.238408227281674,2154.0,,1007.0203364431162
185.0,2024-01-08 16:00,,,16.88235758864342,61.0,10.491793188688517,67.20078518130637,551.0,Fog,
186.0,2024-01-08T17:00Z,,Winter,17.873414914195486,24.0,14.474594840191765,3.4021611082043623,1548.0,Rain,957.0402459709785
187.0,08/01/2024 06PM,London,Summer,8.799067551177075,65.0,110.16751756246424,40.8492249445535,24859.0,,1048.495799822802
188.0,08/01/2024 07PM,,,8.686115082760885,94.0,4.691745062037173,13.553069140583034,2421.0,Rain,1021.0255959671879
189.0,2024-01-08 20:00,London,Winter,25.495358710361515,75.0,25.996968694897255,61.98901314429696,48091.0,,1020.4388739757653
190.0,2024-01-08T21:00Z,London,Summer,6.010886200311138,89.0,23.04259780704454,55.18797411251125,8493.0,Storm,969.7863623761962
191.0,2024-01-08T22:00Z,London,Winter,,55.0,99.9667680939753,4.284385800835837,35189.0,Fog,1028.6653026479728
192.0,2099-13-40 25:61,London,Spring,21.825416659691324,27.0,20.14208732533151,38.976910145292166,7470.0,Rain,951.1635032787171
193.0,09/01/2024 12AM,,Winter,18.89997335096414,60.0,7.315272087832585,3.9758647880253495,4317.0,Clear,1039.4237715290085
194.0,Unknown,,Winter,20.81259401172393,98.0,24.919747496630052,79.37011798587928,3178.0,,1045.4482001121794
195.0,2024-01-09 02:00,,,10.148960594356396,20.0,18.250992933657045,38.9711071722083,6724.0,Snow,965.5995969998578
196.0,Unknown,London,Autumn,6.8987776823525255,,6.904286593416321,14.342082033402264,7385.0,Snow,997.4980453009117
197.0,09/01/2024 04AM,London,Spring,28.799793000904373,43.0,2.4850260351808338,,9317.0,Snow,1047.7424733141602
198.0,2099-13-40 25:61,,Autumn,11.653573536064973,14.0,5.051092875338224,0.24333317067468663,4855.0,Rain,973.573183329176
199.0,09/01/2024 06AM,London,Autumn,11.493132229657697,80.0,3.9312139745421346,60.808014012058905,8058.0,Fog,970.4993579682099
200.0,2099-13-40 25:61,London,Autumn,15.743102869338351,,27.605230285272583,64.43772947790782,2541.0,Rain,1003.8572330277854
201.0,09/01/2024 08AM,London,Summer,,32.0,22.713837621724675,2.1485201337797655,8585.0,Snow,1047.6709607237854
202.0,2099-13-40 25:61,,Autumn,30.500051902319473,21.0,15.562397401897082,17.557081007892272,273.0,Rain,
203.0,Unknown,,Autumn,45.64801124240549,99.0,11.024540301760377,165.35057377930053,5254.0,,958.2481920712888
204.0,2024-01-09T11:00Z,,Spring,14.471110377860557,74.0,1.7850530639604323,11.738370361983428,5909.0,Snow,1005.0486965847861
205.0,2024-01-09T12:00Z,London,Autumn,6.466344233154178,90.0,2.5445083389320877,32.494439047706656,1627.0,,957.469162281492
206.0,Unknown,London,Winter,18.299652819701087,84.0,16.447890526507294,79.24593301740143,8478.0,,974.762109271741
207.0,2099-13-40 25:61,,Spring,17.618079589861,86.0,18.421265852590405,60.26798389552069,1636.0,Clear,977.1512742064641
208.0,2099-13-40 25:61,London,Summer,18.15161082406849,65.0,6.742116871278272,32.4235323075507,5339.0,Rain,956.0012632595921
209.0,Unknown,London,Autumn,30.932111977444748,88.0,11.142016343501881,12.504915465363444,89.0,Fog,1003.4346040766857
210.0,2024-01-09 17:00,London,Summer,24.226820211319833,71.0,26.525084047480433,,3360.0,Clear,986.4189443870557
211.0,2024-01-09T18:00Z,London,Summer,6.496774876872971,76.0,9.463205644163274,37.846278614311935,3335.0,Rain,956.1987422630499
212.0,09/01/2024 07PM,,Spring,-17.337815852645345,78.0,1.7456875363910473,14.40660826571408,1150.0,,961.7908349938003
213.0,2024-01-09 20:00,London,,16.345214971009632,83.0,9.924386588901307,173.70515280400986,1921.0,Clear,974.1945348196659
214.0,2024-01-09T21:00Z,,Winter,10.744937832436978,85.0,7.589119707212736,229.77890951438326,,Clear,989.4057312007163
215.0,2024-01-09T22:00Z,London,Summer,11.963722715398639,64.0,28.37429799760528,20.7387978580571,21679.0,,1035.2037555113955
216.0,2024-01-09 23:00,,Winter,22.168029629563947,51.0,0.16824456690875955,17.608371932246698,1131.0,Rain,
217.0,2024-01-10T00:00Z,London,Autumn,9.286079545517683,32.0,11.814306664332202,36.85527362057948,1265.0,Fog,965.0541268058938
218.0,2024-01-10 01:00,,Winter,23.319603433724275,81.0,7.170813558825727,49.89630524673089,4961.0,Storm,1000.471394904596
219.0,Unknown,London,,15.973390601206498,45.0,7.377533797883186,35.55642543206935,6773.0,Storm,966.7680959901572
220.0,2024-01-10 03:00,,Winter,7.8116947035322095,91.0,24.7336969937337,15.142047413381139,918.0,Storm,973.8671478420467
221.0,2099-13-40 25:61,,Winter,24.3827807694083,30.0,28.67350038808056,34.03755760233502,3546.0,Fog,1004.6648595001525
222.0,10/01/2024 05AM,,Winter,41.108484609615125,63.0,16.04514347515073,60.44044086467557,5027.0,Storm,1048.3553005985061
,10/01/2024 06AM,,,22.69730921506287,82.0,25.695207375903315,30.030580495871764,3028.0,Storm,1013.7018056051018
224.0,,,Spring,13.686954295342007,98.0,21.016172587607926,54.02526181892065,7462.0,Snow,984.5356562098272
225.0,Unknown,London,Summer,3.069138890574461,39.0,21.121467142420634,37.00309752426493,3842.0,,996.1117403185093
226.0,,London,,48.710835750363216,23.0,9.29133737805492,4.199648438581169,5365.0,Storm,971.4768300484553
227.0,Unknown,,Winter,13.964150904488168,59.0,7.967632986572343,12.11667560619417,8643.0,Fog,971.7885455724331
228.0,2024-01-10 11:00,London,Summer,10.414958700904467,31.0,69.71258388538057,245.1643711107419,7985.0,Rain,954.2382302695929
229.0,2024-01-10 12:00,London,Winter,4.770135855991715,89.0,29.417037045789325,31.083777111868365,910.0,Rain,1024.1299329551364
230.0,2024-01-10T13:00Z,London,Spring,46.99249531590048,23.0,22.474494743335125,23.15573144150502,2581.0,Rain,1043.5984484990424
231.0,2099-13-40 25:61,London,,10.074543041438243,46.0,22.107562041842495,46.502536978622445,3879.0,Snow,1037.402166632795
232.0,2024-01-10 15:00,,Summer,7.5988998060790385,58.0,25.167156549890198,66.59873553667714,2459.0,Clear,1007.7462184665758
233.0,2024-01-10T16:00Z,London,Spring,41.941718423263154,79.0,79.91512822749408,236.97184130815975,3355.0,Clear,1022.2663961135079
234.0,10/01/2024 05PM,London,Autumn,24.183018894427583,,15.899704885153927,50.83899497925415,7729.0,,1018.958149501107
235.0,10/01/2024 06PM,,Autumn,19.3386386445313,91.0,13.040600329560725,70.09636275821055,4929.0,Snow,977.9660448447102
236.0,2024-01-10T19:00Z,London,Summer,4.388754010749674,48.0,56.47978334899959,3.5875432250211325,,Rain,971.8563418063907
237.0,2099-13-40 25:61,London,Autumn,9.26953350517139,85.0,13.269741639998282,51.15253024751789,5526.0,Snow,974.0746569598813
238.0,10/01/2024 09PM,,Winter,-0.46267414950438734,97.0,15.825547075216628,17.67584122153086,9707.0,Rain,988.5413154609834
239.0,10/01/2024 10PM,,,,68.0,10.644035021276881,66.22860148721145,454.0,Storm,1047.4299940984743
240.0,10/01/2024 11PM,,Winter,19.952336849912328,68.0,7.456679932377742,32.734830869364096,8274.0,Fog,
241.0,11/01/2024 12AM,,Autumn,7.411817319421691,72.0,19.939073598977206,20.834152569892737,26225.0,,1024.998068057171
242.0,2024-01-11T01:00Z,London,Spring,14.587309814157903,95.0,20.288968073833665,27.55451735132784,9131.0,,
243.0,2024-01-11T02:00Z,,Spring,4.078264327967997,33.0,4.678092326982854,25.838461189934733,315.0,Clear,964.766470172736
244.0,2024-01-11T03:00Z,,,17.163819612318484,39.0,5.988992624792039,70.69577531871414,3944.0,Fog,950.0493407988644
245.0,2099-13-40 25:61,,,14.458272347080012,62.0,21.887428768659206,18.07367240644476,7519.0,,1017.9438906133236
246.0,2024-01-11T05:00Z,London,Spring,20.918459373581484,41.0,27.569225283580888,106.44052148633436,25206.0,Rain,1019.1229404786146
247.0,2024-01-11T06:00Z,London,Autumn,18.832147891750207,76.0,8.63162050777564,23.662055689324035,7897.0,,1032.2611080405804
248.0,2024-01-11 07:00,,,14.880929676209158,78.0,15.03070479262312,21.667904819379746,29239.0,,1032.1378869746134
249.0,2024-01-11T08:00Z,London,Spring,-18.340614481376644,58.0,17.980546129452176,110.09018196141575,806.0,Clear,998.1883882410386
250.0,2024-01-11 09:00,,,19.65359178276571,67.0,19.69070136867261,48.711535638178994,6562.0,Fog,1010.705489568499
251.0,11/01/2024 10AM,,Autumn,17.97217937833558,33.0,28.35812169190146,19.834515822334822,5211.0,Rain,964.2371833046358
252.0,2024-01-11 11:00,,Summer,2.92333337683111,90.0,22.33813887448814,41.37544693042068,5479.0,Fog,984.2586092065542
253.0,11/01/2024 12PM,London,Winter,-19.64884736399623,,2.936497841150647,48.30638206187381,8365.0,Snow,1004.9775340830976
254.0,Unknown,,,15.64295873675083,70.0,14.915109137799533,36.90933619262423,3057.0,Fog,954.4692998713659
255.0,Unknown,London,Summer,-18.764041017242793,22.0,28.38014964156266,26.656544551437847,,Fog,981.2208883953766
256.0,Unknown,London,Spring,27.02653583271091,47.0,4.854169123117962,48.90578718261145,26995.0,Snow,951.6735079829193
257.0,11/01/2024 04PM,,Summer,1.4100623939805157,63.0,25.5256266842148,26.97673469428791,1289.0,Clear,970.9723297039186
258.0,2099-13-40 25:61,London,Winter,1.7928497791767395,83.0,98.55370955210182,47.233430188599755,4626.0,Rain,1043.1773254539323
259.0,11/01/2024 06PM,,Autumn,28.110673229653703,76.0,11.834958594369278,51.6385493197094,38065.0,Clear,1028.4083495674336
260.0,Unknown,,Summer,8.351391355645173,41.0,0.7951414013978664,21.172131640421867,9749.0,Rain,1000.3374249882191
261.0,2099-13-40 25:61,London,Summer,31.49693083657745,97.0,148.91385494097455,19.618226663366485,6326.0,Clear,964.589123419401
262.0,2099-13-40 25:61,London,,24.580474475154,82.0,18.74450155060169,35.215275307658885,,Fog,1003.0941183818178
263.0,2024-01-11 22:00,London,,14.049720273186814,36.0,28.07878509564689,28.14545964299719,2565.0,Rain,995.2422915418172
264.0,,London,Spring,,71.0,20.063236411631177,52.55145809910729,26293.0,Rain,1002.2782987623604
265.0,2024-01-12 00:00,,Autumn,45.88718782089596,58.0,3.412193943161977,73.83952346466894,1147.0,Snow,1014.6205390835389
266.0,2099-13-40 25:61,,Spring,11.46514232938461,34.0,0.031828731758813955,10.920440200460426,36255.0,Fog,1021.7945545739046
267.0,2024-01-12T02:00Z,,,9.004173219141684,45.0,21.44370650536877,219.44607729564262,1721.0,Storm,961.3137067365188
268.0,2099-13-40 25:61,,,,67.0,12.35565473037894,176.31962689220305,7857.0,,981.3317380845599
269.0,12/01/2024 04AM,London,Summer,18.809355410759597,73.0,29.913843319964183,22.022196080895718,9400.0,Clear,968.8490970526727
270.0,2099-13-40 25:61,,Summer,10.45652701429021,58.0,8.31057816259599,49.592812752778414,1380.0,Fog,1040.7343239119718
271.0,2024-01-12 06:00,,Spring,5.022846512088284,91.0,0.1657539063094593,75.26850080270309,2522.0,,985.0185585932293
272.0,2099-13-40 25:61,,Autumn,5.179338321952969,70.0,6.472933190421617,8.219460479362173,6345.0,Fog,
273.0,Unknown,,Autumn,7.013553767768257,22.0,29.2986149131307,4.269370941372843,,Storm,1037.2848229098458
274.0,2099-13-40 25:61,London,Spring,-28.565035513020142,,19.315568542660216,17.754446571768653,33154.0,,985.0106776894746
275.0,12/01/2024 10AM,London,,14.403987899333927,24.0,1.7142123494187433,8.696140980708211,8594.0,,996.3519860555745
276.0,2024-01-12 11:00,London,Autumn,15.903756355837324,97.0,21.087800445953054,66.72044711570595,4542.0,Clear,1026.7105344187426
277.0,2099-13-40 25:61,,,-23.173072325193186,53.0,1.110398985917862,68.97526334601666,8432.0,Storm,963.9558765922851
278.0,2024-01-12T13:00Z,,Winter,15.571174633219666,37.0,9.518901534274487,33.45775417557104,3009.0,Snow,1030.8867063635776
279.0,,,,22.540665839226037,36.0,7.395764055855962,2.45472294954979,5234.0,Clear,1029.9970559662042
280.0,2024-01-12 15:00,,Winter,16.83549085657708,48.0,27.77079265622276,25.145532878470913,8191.0,Rain,969.5336419250104
281.0,12/01/2024 04PM,London,Winter,23.400456754203375,65.0,24.9837319573987,45.50812470511333,7632.0,Rain,
282.0,2024-01-12T17:00Z,,Winter,10.964985082917192,96.0,12.46285189336186,143.2323476375781,7417.0,Fog,1010.363929567155
283.0,2099-13-40 25:61,London,Winter,15.05268674960008,40.0,27.449250215214406,247.37406269076496,3273.0,Clear,999.537683365305
284.0,12/01/2024 07PM,,Spring,15.992534242400946,22.0,17.590472303139844,61.86259173111403,8500.0,Storm,1013.2249027881851
285.0,2024-01-12 20:00,London,Autumn,50.13897247979227,33.0,13.661289307052316,31.735845112058918,6080.0,,1027.2468579244123
,2099-13-40 25:61,London,Autumn,14.792220797008225,83.0,126.12535533032158,8.985824538210041,7362.0,,981.6528837002104
287.0,2099-13-40 25:61,London,Autumn,17.060631174120353,15.0,27.331189323224375,3.103208168802576,412.0,Snow,975.8588615614758
288.0,12/01/2024 11PM,,Autumn,21.61605523044284,87.0,25.07445816591549,60.39897746506017,5843.0,Snow,984.0123659943071
289.0,2024-01-13 00:00,London,Summer,13.337968472638591,80.0,8.63510061443056,54.04370188422489,7623.0,,1037.5044776637912
290.0,13/01/2024 01AM,,Autumn,25.503349162162095,45.0,3.893318199513333,49.733665538633105,8743.0,Storm,958.9964215814284
291.0,2024-01-13T02:00Z,,Summer,16.338663762171816,39.0,144.46993800211308,35.14966543193806,5523.0,Fog,1032.8935796178612
292.0,2099-13-40 25:61,London,Summer,6.952282152205468,34.0,,6.015505066636981,6836.0,Snow,957.036254857309
293.0,2099-13-40 25:61,,,-0.4377369995984228,92.0,1.1781546826563138,65.68949520722298,9692.0,,1044.599611233035
294.0,Unknown,London,Spring,14.321009907582043,91.0,17.875458758686424,42.35529608140263,9181.0,Fog,1026.5357756272438
295.0,2024-01-13 06:00,,Autumn,8.609541914898541,44.0,26.843769144309498,26.217401995800067,6821.0,Storm,1016.1675808210259
296.0,Unknown,,,4.8061917052252365,71.0,23.72206444233375,38.438404285849884,2639.0,Storm,1044.4494038870612
297.0,Unknown,London,Summer,36.11049110102013,73.0,15.135955945150117,59.761518314629704,7762.0,Fog,1024.518913335241
298.0,2024-01-13 09:00,London,Spring,-23.325007439662706,29.0,27.165582463480305,69.75564195293872,34290.0,Fog,1024.8111660597085
299.0,,London,,10.95287546071499,60.0,3.8723020641847183,40.59736878931141,233.0,Storm,1017.3341135367531
300.0,2024-01-13T11:00Z,London,Winter,26.455946088063882,56.0,6.434900425792382,6.2507534411096,6987.0,Snow,1037.645964814202
301.0,2024-01-13 12:00,London,,,65.0,15.392243074031507,55.343325765507544,5395.0,,961.9677911365443
302.0,2024-01-13 13:00,,Summer,12.820149291291003,53.0,2.520263413850298,109.41269527142948,1093.0,Fog,1035.9141356001262
303.0,13/01/2024 02PM,,Autumn,25.09195105572254,26.0,52.302786773637244,18.03394740807848,1436.0,Clear,1042.3214925569305
304.0,2099-13-40 25:61,,Autumn,5.660128710840711,53.0,11.500413158676624,75.08330936889357,8777.0,,963.8919760097544
305.0,13/01/2024 04PM,,Spring,19.708685993373518,47.0,7.877477686858324,227.1433927474219,8432.0,,1015.1922886832135
306.0,2024-01-13T17:00Z,London,Summer,19.1823059123121,97.0,23.542767405396486,22.373752816558472,4588.0,Clear,1000.1347303132226
307.0,13/01/2024 06PM,London,Summer,56.63949323301384,,18.727570782118462,67.71207293378373,7686.0,,1008.508193896144
308.0,13/01/2024 07PM,London,Summer,5.793357771596469,35.0,24.843353303744117,66.4789142704434,5589.0,Storm,1001.7234864520514
309.0,2024-01-13T20:00Z,,Summer,8.536473367551544,89.0,17.875736431816257,13.104531578646021,22177.0,Clear,966.6962996532989
310.0,2024-01-13 21:00,London,Spring,14.12789512098356,40.0,21.595708611946705,175.88970354902452,7640.0,Snow,1012.0596960639496
311.0,2024-01-13 22:00,London,Summer,57.829451803494464,42.0,16.802866864598865,75.64050202635657,4658.0,,1006.4900648663595
312.0,2024-01-13T23:00Z,London,Summer,4.25370600689099,94.0,70.83399856484766,12.375352471483012,5017.0,Clear,1020.5791667029039
313.0,Unknown,,Summer,5.1120300025383685,28.0,22.739463440620412,22.03218649637952,6673.0,Clear,1003.2766981774124
314.0,2024-01-14T01:00Z,London,,15.204902829830099,88.0,16.688086679834424,39.21220435553023,5345.0,,1044.419134562713
315.0,2024-01-14T02:00Z,,Autumn,15.94766658819122,48.0,105.77358428670343,42.07533600280304,4700.0,Rain,981.1183716768313
316.0,2024-01-14 03:00,London,Spring,8.2838408255773,75.0,22.17330719217981,70.06820042138526,,,1034.5145386657805
317.0,2024-01-14T04:00Z,,Spring,17.738257837348957,16.0,14.795028713841084,22.126189480363642,30152.0,Clear,995.3138243576602
318.0,2024-01-14T05:00Z,,,9.459923126806313,21.0,111.02117441887383,31.60886859871276,3663.0,Rain,962.2361330643986
319.0,2024-01-14T06:00Z,London,Winter,17.84924299226477,23.0,,54.28457600428797,596.0,Storm,1049.361707884159
320.0,2099-13-40 25:61,London,Winter,11.92044240709859,75.0,23.017613183063208,75.84101301096118,32885.0,Storm,1020.5915662145251
321.0,14/01/2024 08AM,London,,8.930423272978263,76.0,3.965378208311292,60.37125553291369,3647.0,Fog,959.0169357769705
322.0,2099-13-40 25:61,,Spring,16.00746041061444,34.0,15.652020711481445,22.859716692267753,7651.0,Fog,963.5508728757393
323.0,2024-01-14 10:00,,Spring,12.433997016856031,56.0,23.841142333242672,17.023513271166124,7481.0,Storm,997.7676338545273
324.0,2024-01-14T11:00Z,,Spring,19.692981286992186,54.0,4.726702751593503,72.00194286482125,9181.0,Snow,970.542333202356
325.0,2024-01-14 12:00,,Autumn,-0.8449365180830561,46.0,0.9647887831802393,60.94022699555233,6122.0,Fog,993.066804099463
326.0,Unknown,London,,27.513122148851807,88.0,4.92335099939818,66.23501579863132,7283.0,Storm,989.9485512317771
327.0,14/01/2024 02PM,London,,3.4762397566363905,36.0,27.004112501340707,78.79092905257765,5095.0,Clear,993.9032990166529
328.0,2099-13-40 25:61,London,Winter,11.815887642152095,56.0,23.58415550521383,55.134984120569506,20734.0,Snow,1013.8678791790851
329.0,14/01/2024 04PM,London,Winter,20.82788396685473,22.0,24.939441039458814,34.06158624991586,8113.0,,1040.7173405413923
330.0,2024-01-14 17:00,,Spring,3.0172565928972634,47.0,21.63695452637712,24.887771898318487,1540.0,Fog,963.9428740706292
331.0,2024-01-14 18:00,,Summer,9.6656206079587,64.0,,17.83012636224739,4182.0,Snow,996.7836630670301
332.0,14/01/2024 07PM,London,Spring,10.928136579929118,20.0,14.681353713913142,55.55915129397667,1920.0,Snow,979.6176635670516
333.0,14/01/2024 08PM,,Spring,10.071507522758779,73.0,26.84617161415515,63.464885627503506,8074.0,,970.8773231057613
334.0,2099-13-40 25:61,,Summer,20.342642397515032,42.0,61.97374246167192,12.762366447248139,3893.0,Rain,960.7359885728592
335.0,Unknown,London,Autumn,,85.0,51.145801339895336,42.71829888896468,1080.0,,985.9520680445783
336.0,2024-01-14 23:00,,,20.087712776265654,79.0,25.786889445615813,53.9560692076823,5638.0,,995.1795059430594
337.0,2099-13-40 25:61,,Winter,19.418756332406097,20.0,7.844368236068126,16.294157433591224,7664.0,,1047.352492369645
338.0,2024-01-15 01:00,London,Spring,7.064366532020198,70.0,0.5777501486700776,77.46165727047793,9147.0,Snow,1009.3103023669069
339.0,2024-01-15T02:00Z,London,Spring,15.128393943995981,25.0,19.387773587825148,20.178307592598426,752.0,Storm,1029.003335608274
340.0,2099-13-40 25:61,London,Autumn,11.462996887012492,79.0,24.06220025706829,35.580848309342144,6821.0,Storm,963.5179222649521
341.0,2099-13-40 25:61,London,,47.503148861496264,48.0,5.281422760588308,13.497295051312665,5099.0,Clear,1012.6865049836907
342.0,2024-01-15T05:00Z,,Summer,7.0170791824146255,44.0,7.391191656547777,68.2033260055438,243.0,Clear,969.769205884322
343.0,2024-01-15 06:00,London,Spring,10.638754951183424,54.0,10.391465592799772,30.294225059034385,8023.0,Rain,954.4527577703012
344.0,2024-01-15 07:00,,Autumn,14.803776138644775,24.0,0.2830362518311025,61.923592602887425,7678.0,Rain,1015.1266032758315
345.0,2024-01-15T08:00Z,London,,20.29251545393078,35.0,28.971260602666614,67.17379939558457,1014.0,,963.6089819436045
346.0,2024-01-15 09:00,,Spring,2.395098073085048,96.0,134.80967825212315,42.510580701938714,1025.0,Rain,1022.6806496249399
347.0,2099-13-40 25:61,,Autumn,6.213346890367545,30.0,136.837255782054,170.72688949928875,4123.0,Fog,1010.3526960891269
348.0,2099-13-40 25:61,London,Summer,18.264288827934976,63.0,8.091337558291144,134.74114855664897,2617.0,Snow,974.9263639584829
349.0,15/01/2024 12PM,London,Winter,0.3195203738090058,43.0,2.8280702904843613,221.2873974345979,9214.0,Rain,1048.3700813561977
350.0,2024-01-15 13:00,,,32.65231106001083,68.0,29.405289446389883,31.21803994657632,7221.0,,1007.3638844770488
351.0,,London,Spring,15.402803906714986,28.0,134.28984888271117,65.86791795778994,8995.0,Snow,999.1124841698573
352.0,15/01/2024 03PM,London,Summer,31.985605993490534,59.0,91.25413708201401,26.33767184545637,7085.0,Fog,978.8387466464554
353.0,15/01/2024 04PM,,Autumn,8.776494456339663,39.0,13.715245546995119,75.60891702624893,1688.0,Snow,1048.8362628885352
354.0,2024-01-15T17:00Z,,Spring,11.671154661282838,110.0,26.304001802177723,22.941880558616738,418.0,Snow,1029.0105222826874
355.0,,,Autumn,14.81814963560899,82.0,26.048267010051063,218.73283693123966,6783.0,,1036.954048091797
356.0,15/01/2024 07PM,London,Autumn,38.15139080856213,80.0,25.332903151438533,13.284545041825186,1813.0,Snow,963.6649345574887
357.0,15/01/2024 08PM,London,Autumn,17.400196064727425,,18.374207723032868,185.0120045667182,9293.0,Clear,990.205118868745
,2024-01-15 21:00,London,Winter,-0.004353482455062618,44.0,2.6177761471788386,43.946748549021365,6955.0,,968.9842537615841
359.0,Unknown,,,19.815049338150878,69.0,0.5018046498725737,41.49625520655452,39877.0,Clear,964.4994816249898
360.0,15/01/2024 11PM,London,Autumn,19.389813178426422,25.0,18.90771356075542,29.49627152065812,6875.0,,957.3154710182472
361.0,16/01/2024 12AM,,Spring,12.356222456503914,35.0,22.38363197183872,0.3613153409844383,6383.0,Storm,972.4770566920943
362.0,2024-01-16 01:00,London,,12.061235572305815,74.0,7.02426435495396,9.572442484927866,7117.0,Clear,970.2853653262296
363.0,,,Summer,14.133651013536316,89.0,15.846017754296623,19.203135263195954,5585.0,Snow,1017.5060055386393
364.0,2099-13-40 25:61,London,Autumn,11.353795926541812,95.0,8.076380593296195,16.82110878940336,4342.0,Snow,968.3242123385135
365.0,2024-01-16T04:00Z,London,,8.848656290593102,30.0,140.50240260954934,59.79780916594967,5228.0,Snow,1042.846733125649
366.0,2024-01-16 05:00,London,Spring,9.152771691514385,38.0,9.637664804055321,27.86064019237193,49735.0,Clear,969.5537298162947
367.0,2099-13-40 25:61,London,Summer,21.447098671465856,24.0,13.584618831096689,42.59550703721342,7567.0,,969.5574197581866
368.0,2024-01-16T07:00Z,,,-2.4949270655326927,24.0,80.70003159092859,7.523933242845784,2664.0,Snow,984.1183146278635
369.0,Unknown,London,Spring,22.829637356107092,47.0,18.968422783745183,43.59336892687721,6060.0,Storm,954.5188213372626
370.0,2024-01-16T09:00Z,,Spring,28.056222988305834,81.0,7.41156507606831,72.54949584245672,4777.0,Clear,1005.4583188427347
371.0,2099-13-40 25:61,,,30.481639001627926,126.0,15.733051115646582,15.430133484623925,560.0,Rain,1038.2665854143352
,2099-13-40 25:61,London,Autumn,15.830202710737817,28.0,18.14110428684345,71.98064206084786,2186.0,,977.5754349153667
373.0,2024-01-16T12:00Z,London,Autumn,16.912614406130462,63.0,24.640354097361065,61.74180976199206,4401.0,Fog,1035.1428639189485
374.0,16/01/2024 01PM,,Autumn,32.09851973278239,41.0,97.25145616480805,56.48509171276943,9728.0,,
375.0,2099-13-40 25:61,London,,4.508512466935917,88.0,16.860223927171585,61.12110221973435,3698.0,,962.2254025239396
376.0,2024-01-16 15:00,London,Winter,,72.0,19.43869950585728,52.98674865965421,9879.0,Snow,976.3637892465289
377.0,Unknown,,Summer,14.280598662928965,99.0,11.759663985008862,65.79980180746928,8283.0,Fog,951.0784120843146
378.0,2024-01-16 17:00,London,Autumn,20.720372836177063,79.0,13.439591004464459,17.13554480944543,3141.0,,959.8875475645989
379.0,2024-01-16T18:00Z,,Summer,19.741444733373505,,19.57025275575613,2.843159724115303,6139.0,Snow,982.2414465857727
380.0,2024-01-16T19:00Z,London,Spring,13.05778730098062,98.0,2.9056409055884034,206.37830411613606,6558.0,Fog,1039.7053402388915
381.0,2099-13-40 25:61,London,Winter,27.30927030712136,96.0,4.730656769295254,61.29164151516931,4862.0,Snow,999.6038647884872
382.0,2099-13-40 25:61,London,,24.119346388705768,46.0,9.175483920690365,66.59062473462002,2131.0,Rain,1049.1376322158314
383.0,2099-13-40 25:61,,,23.107296976112615,36.0,17.92781838468763,21.854005198742534,8416.0,Snow,1048.4385678835367
384.0,2099-13-40 25:61,,,,111.0,14.437305072368073,18.890270713407098,2525.0,Clear,976.1890431142011
385.0,2024-01-17 00:00,,Spring,2.1057368707506985,79.0,0.14088495062414497,34.95974719033606,705.0,Snow,973.3926946861994
386.0,17/01/2024 01AM,,Spring,16.216514064368887,54.0,14.06128352713218,53.3880587819441,739.0,Storm,961.3867326237552
387.0,Unknown,,Winter,16.553526915634453,45.0,12.206666451924885,202.44271681414534,2849.0,,985.0419276434062
388.0,2099-13-40 25:61,,,24.08662599558771,26.0,14.727924007801397,13.956777229144057,911.0,Rain,1029.795397153981
389.0,Unknown,,Summer,10.444734406710726,,29.929290153924054,9.392698022727606,6551.0,Rain,954.8309975675124
390.0,2024-01-17T05:00Z,London,Autumn,-29.546128674626488,83.0,19.149670460886462,15.708090522743259,5015.0,Storm,999.2270001988666
391.0,2024-01-17 06:00,,Winter,-0.623296845578496,63.0,1.7773373343964571,49.267446764293666,5109.0,,984.367482582231
392.0,Unknown,,Summer,29.56172693402471,31.0,2.832983941011266,22.692175911717047,7636.0,Fog,1039.7830671553506
393.0,2024-01-17T08:00Z,London,Winter,20.51474070735959,47.0,5.829659721381391,72.76624532764127,6975.0,Fog,1016.2671084375525
394.0,2024-01-17 09:00,,Summer,21.48998228756559,118.0,2.8401870748434233,28.645820664867223,7957.0,Snow,1004.2371677812479
395.0,2024-01-17 10:00,London,Spring,27.523573515192123,34.0,29.11519648104772,50.71101866444229,49956.0,Storm,1047.4464653232078
396.0,17/01/2024 11AM,,Winter,7.391596745363228,21.0,18.55940935915692,57.07910444075818,6371.0,Clear,
397.0,2024-01-17T12:00Z,,,12.733001882143668,57.0,19.503963593673852,72.42884131221975,839.0,Rain,1030.0825991338386
398.0,17/01/2024 01PM,London,Winter,-19.00819856228196,59.0,99.22817399149778,201.22385978067598,9966.0,Fog,1026.4426135196793
399.0,2099-13-40 25:61,London,Autumn,-21.41220581547369,93.0,21.68778398973154,42.69590893110653,2227.0,Snow,985.4621182027811
400.0,17/01/2024 03PM,London,Winter,55.221876298571,46.0,22.895982574231216,77.11680766541495,9994.0,Storm,980.9596289477564
401.0,Unknown,London,Autumn,31.668414385672286,89.0,16.056607046346905,36.0665516521692,119.0,Clear,964.8740962664101
402.0,2024-01-17 17:00,,Summer,9.974384651029407,71.0,15.363365602216964,69.20067842707681,28217.0,Fog,961.6820245964994
403.0,17/01/2024 06PM,London,Autumn,18.200008294681446,37.0,25.196372134860738,16.285159803344058,1079.0,Fog,975.2666203398087
404.0,17/01/2024 07PM,London,Summer,-24.83062632686258,68.0,3.2071863027169103,50.5905962648475,978.0,,
,2024-01-17 20:00,,,15.375019415964672,69.0,,5.371343961487778,1345.0,Clear,953.9456891702471
406.0,2024-01-17 21:00,,Winter,5.741008861396855,74.0,1.304433971143224,3.3448870572078437,849.0,Rain,1036.120492264451
407.0,,,Summer,27.238233538115523,32.0,29.985711351873977,8.659347306369432,6525.0,Storm,972.0124402210605
408.0,2099-13-40 25:61,London,,23.370307314532337,35.0,26.795877925422168,39.60775579436968,6126.0,Clear,1013.9306227496495
409.0,2024-01-18 00:00,London,,,23.0,16.573881586957626,7.182697990528695,27317.0,Rain,962.6721396350079
410.0,Unknown,London,,1.4779075020617576,30.0,19.82286528451498,26.530052321693532,8440.0,Clear,1012.1591886428648
411.0,2099-13-40 25:61,,Winter,22.54089141974022,42.0,15.946657109787902,61.31187697249669,8373.0,Storm,1034.2039186757231
412.0,2099-13-40 25:61,London,Summer,-17.59040917259527,80.0,21.842650634404446,32.499959510003826,6556.0,Fog,956.7633286743229
413.0,,,Spring,13.000616942547206,87.0,24.07226493355777,59.02466004414077,7467.0,,1028.9890033423876
414.0,Unknown,London,Spring,26.07711705066409,,23.62657572962913,4.18656780396625,9462.0,Snow,975.416451750493
415.0,2024-01-18T06:00Z,London,Summer,14.241075161269446,69.0,20.298072356744726,36.16441437982707,3868.0,Storm,1043.1916118371214
416.0,Unknown,London,Autumn,,81.0,15.512015740804056,24.475542669051347,3051.0,,1049.7021207043979
417.0,Unknown,,Autumn,0.5032435464072069,116.0,12.510373302581252,28.8528490226523,334.0,Snow,971.8918975443452
418.0,2024-01-18T09:00Z,London,Autumn,14.498781522323794,70.0,19.3576380243949,5.28445987767908,9090.0,Storm,1019.893952774763
419.0,2099-13-40 25:61,,Autumn,17.135273369963738,96.0,1.425652400137949,19.084327458209238,4565.0,Snow,966.6089149003845
420.0,Unknown,,Summer,5.821024208317235,21.0,135.81626169415338,66.5459192411693,45264.0,Fog,957.5916221015048
421.0,2099-13-40 25:61,,Summer,16.95944630756661,97.0,15.27924997273606,37.92018688428645,1194.0,Snow,1025.9304328547416
422.0,18/01/2024 01PM,,Autumn,14.099707926528684,96.0,12.220075730975903,42.6827797814756,6114.0,Rain,995.9749987496004
423.0,18/01/2024 02PM,London,Autumn,26.25613585818762,94.0,20.901080692575736,55.42804136914778,636.0,Snow,1010.6964907401483
424.0,2024-01-18T15:00Z,London,Spring,16.699073811319877,39.0,,22.73854234557384,5361.0,Snow,1001.6293711346109
425.0,2024-01-18T16:00Z,London,,27.543686489106996,92.0,8.800278865516658,9.350443711367804,5735.0,,970.3393909913567
426.0,Unknown,London,Winter,13.600686164929936,79.0,2.0740701744228973,43.42128389652369,9574.0,Clear,968.6343241233095
427.0,18/01/2024 06PM,,Summer,21.09763699739549,82.0,28.690687948832085,57.433049519210996,1970.0,Fog,955.0179143063882
428.0,,London,,11.808113394156578,73.0,27.26564203461284,7.692125353489905,9448.0,Fog,957.4159649812786
429.0,2024-01-18T20:00Z,London,Autumn,19.963352883437256,92.0,7.205914624965071,233.85225966828997,4538.0,Snow,1045.1341628757552
430.0,18/01/2024 09PM,,Winter,7.17942792057894,39.0,18.800412209733956,137.75514926540393,9030.0,Clear,1023.267665262989
431.0,2024-01-18 22:00,London,Autumn,30.11046017867359,20.0,26.39713565838601,56.57763887764615,,Snow,1011.2128119697267
432.0,18/01/2024 11PM,London,,24.641518462611067,86.0,53.81021196829037,153.74197923165673,6100.0,Fog,1047.574943789113
433.0,2024-01-19T00:00Z,London,Spring,14.076599165802387,23.0,3.1632070999234188,38.96311208512039,37505.0,,972.7381989528081
434.0,19/01/2024 01AM,,,14.181028435162014,95.0,18.20126836234897,55.00394109574952,3428.0,Fog,1001.5508647534176
435.0,2024-01-19 02:00,London,Summer,21.716522339132233,30.0,29.305264096154247,,4904.0,Snow,1034.3969450490995
436.0,2099-13-40 25:61,,,18.804271849668496,28.0,129.37503326798912,15.335077647266981,5146.0,Clear,
437.0,2024-01-19 04:00,London,Summer,15.455029379613222,73.0,8.169711552789439,16.959233308319313,7007.0,Clear,968.7777719675994
438.0,2099-13-40 25:61,London,Winter,25.3513015253323,22.0,19.66467955005356,51.61687368806115,2443.0,Storm,1033.1422501943161
439.0,2024-01-19T06:00Z,,Winter,16.381521543719476,85.0,7.3226239977167475,140.16154742212223,4997.0,Storm,
440.0,2024-01-19T07:00Z,,,12.598206415172855,76.0,27.649960320112452,29.480283681427313,2366.0,Rain,1025.2885619435654
441.0,Unknown,,Winter,0.7340954285201775,24.0,5.396889346321345,72.69835726334092,7652.0,Snow,1035.754410914142
442.0,19/01/2024 09AM,,Winter,6.183237588630897,72.0,9.001750969562739,49.78695971895354,48603.0,,963.3258888224283
443.0,,London,Autumn,22.685493595750376,82.0,1.463958621008119,17.10663020277235,957.0,Rain,977.0913537290592
444.0,Unknown,London,,17.655519145480756,89.0,104.52058805264917,30.73047142598942,,Snow,1004.7351101053275
445.0,19/01/2024 12PM,,Summer,25.27376141023736,58.0,6.272881471812547,23.026680924594203,6972.0,Storm,1040.2156903518842
446.0,Unknown,,Spring,12.531710876648178,87.0,16.00040520725484,209.62311846586977,3761.0,Fog,998.2873733544629
447.0,Unknown,London,Summer,10.733210412240515,99.0,29.63972631643541,10.057950624774783,8085.0,Storm,1018.017265203141
448.0,Unknown,,Autumn,16.47920094645564,85.0,97.72045200013966,4.591374950049172,1725.0,Storm,1033.3252414466308
449.0,Unknown,,Autumn,12.959684137767109,57.0,111.64890128458481,37.20057467771892,5008.0,Fog,1037.7135345915576
450.0,2099-13-40 25:61,London,Autumn,11.898819376237254,87.0,24.98695633617347,62.12335946051205,22475.0,Rain,1035.8742018654264
451.0,Unknown,London,,9.242517653132682,39.0,108.54625818932496,39.23446824191021,2013.0,Clear,1021.06984253167
452.0,2024-01-19 19:00,London,Winter,-15.786191676895085,34.0,14.924102199824684,10.851127160186218,7160.0,Snow,1012.6580897467425
453.0,2024-01-19 20:00,London,Summer,20.359621754291005,42.0,1.7842109953833851,34.03886927428061,5857.0,,1038.570990295067
454.0,2099-13-40 25:61,London,Spring,54.05760430877919,78.0,21.90666319728421,13.553122893368368,4525.0,Storm,1002.8240880575804
455.0,19/01/2024 10PM,,Spring,6.522365340875343,34.0,29.838678942941364,67.30034655754372,8256.0,Fog,960.3683352935941
456.0,Unknown,London,,12.88904573408618,51.0,17.16189837066401,41.31892803075306,2385.0,Fog,986.4930759126642
457.0,2024-01-20 00:00,London,,13.419662639368768,,18.277984442100767,9.102126048023367,720.0,Snow,1044.7994440132245
458.0,2024-01-20 01:00,London,Summer,,72.0,16.52093958027388,38.64365566293274,2631.0,Fog,990.8231313199652
459.0,2099-13-40 25:61,London,Spring,24.46965065259947,43.0,5.471780115830884,28.357885857639058,6644.0,Clear,956.5546501100079
460.0,2024-01-20 03:00,,Summer,8.687371591651608,71.0,27.201876387777435,11.334586295345064,713.0,Fog,972.5519235959061
461.0,2024-01-20 04:00,London,Summer,1.9849619868676882,67.0,16.87251209549543,34.10684066918316,820.0,Storm,1033.399517623737
462.0,2024-01-20 05:00,,Autumn,21.519522847394505,81.0,10.016630656928589,36.42990433399544,6573.0,Clear,1019.125442297367
463.0,2024-01-20T06:00Z,,Autumn,18.44008828906941,61.0,16.493751790344508,11.997376803119693,2356.0,Snow,1043.628796075624
464.0,,London,Winter,4.6782048236719085,73.0,0.09570195313651664,68.13064415368136,1494.0,Snow,1013.4708644532535
465.0,2099-13-40 25:61,London,Autumn,15.015394106014016,87.0,10.99138872820981,196.80258183971654,2401.0,Storm,1007.7149622631923
466.0,20/01/2024 09AM,,Autumn,12.196359216154612,48.0,12.264766887511506,27.980025210273702,4458.0,Clear,1038.9308771310862
467.0,2099-13-40 25:61,London,Spring,1.9639571130630316,60.0,1.401552293521855,43.462306013181184,5468.0,Snow,1012.7687677242938
468.0,2024-01-20 11:00,London,Autumn,-29.72056895721633,42.0,27.02375242145801,56.811192091298246,2071.0,,
469.0,Unknown,London,Autumn,-25.55949387015131,58.0,24.944392142503524,73.46410655136451,7027.0,Fog,1033.5079676218734
470.0,2024-01-20T13:00Z,,Spring,21.34719142512599,-5.0,9.612946961533073,6.524314643908742,4320.0,,1042.6476457180745
471.0,2024-01-20 14:00,London,Summer,3.438198429201755,62.0,3.116754255444032,136.39686905705557,8613.0,Clear,988.8721566181571
472.0,2024-01-20 15:00,London,Summer,21.373252875557274,26.0,13.55493306893353,174.1533667051935,6929.0,Rain,1012.2018829903892
473.0,20/01/2024 04PM,,Summer,14.413861033890143,86.0,12.240984009198089,28.739433147534115,4189.0,Rain,997.1590175565441
474.0,2024-01-20 17:00,London,Autumn,18.903786636217365,26.0,18.821547603861802,17.836108463702267,3824.0,Fog,980.8863465962215
,20/01/2024 06PM,London,Summer,29.650193558204816,95.0,74.52953506720831,110.1789135682372,2980.0,Clear,971.1020896801475
476.0,20/01/2024 07PM,,Summer,16.72897852063384,51.0,10.653944763433861,78.8329427535567,4330.0,Rain,1028.361816557314
477.0,2099-13-40 25:61,,Winter,2.2871486985400153,25.0,14.236119124214817,56.151608571927696,9286.0,,994.5533690925394
478.0,2024-01-20T21:00Z,,,,28.0,28.621866766038952,40.668179384456984,6768.0,Rain,966.294354438409
479.0,2099-13-40 25:61,London,Autumn,17.480712987778354,71.0,10.858001893447172,20.118296048542057,9793.0,Snow,982.3561465492306
480.0,20/01/2024 11PM,,Spring,9.334735659493113,64.0,58.094021896428096,118.4887503812097,4167.0,Clear,1012.6665117324416
481.0,Unknown,,Summer,44.25967502017879,63.0,,74.35341549035479,7249.0,Clear,982.6475681297075
482.0,2099-13-40 25:61,London,Spring,20.175563016123036,26.0,107.79475695184755,,9610.0,Fog,
483.0,,London,Summer,22.36769054690114,45.0,6.844072281008278,8.664324516514501,8330.0,Fog,1008.0074094279383
484.0,2024-01-21T03:00Z,London,Spring,26.257706899046696,75.0,28.182991733449942,46.031292843667956,9056.0,Clear,1016.9214502962
485.0,Unknown,London,Winter,4.750639662193636,64.0,12.783379566257729,61.55508067424765,4200.0,Snow,950.8015679002407
486.0,,,Spring,13.032064474645045,96.0,11.645743558476626,46.131187555550085,3023.0,Snow,1020.3041237876064
487.0,2024-01-21T06:00Z,London,Winter,17.989615717518213,59.0,,18.117579936698405,8199.0,Storm,990.5205284727223
488.0,2024-01-21T07:00Z,,Summer,19.664023756686152,22.0,,216.05549134250464,4155.0,Fog,974.8512594750567
489.0,2099-13-40 25:61,,,18.820855406555147,78.0,20.93041275568484,39.142958632174526,7478.0,,1026.3514998268925
490.0,2024-01-21T09:00Z,,Spring,7.538988381781212,25.0,27.63782888245508,58.268679069054734,9652.0,,967.1645201394789
491.0,Unknown,London,,10.333799372517227,42.0,100.00328892248804,41.38562724133473,5391.0,Clear,990.3169330852094
,21/01/2024 11AM,London,Spring,18.29346708545615,30.0,20.964690179470427,4.5849508546278805,41046.0,Clear,997.4386166189328
493.0,21/01/2024 12PM,,Winter,20.52670124378021,67.0,14.18484802949359,8.558163368476004,2772.0,Clear,1001.0902717607664
494.0,21/01/2024 01PM,,,15.812285940475688,23.0,20.81082369797655,52.03686956643857,8108.0,Snow,
495.0,2024-01-21T14:00Z,London,,10.651326957617435,85.0,11.885535969033658,63.081395667164415,8541.0,Storm,998.7320873141431
496.0,2024-01-21T15:00Z,,Winter,22.236332760684846,97.0,29.460965018206892,49.596130201241024,5159.0,Snow,1021.3328775011414
497.0,Unknown,,Spring,18.067201388239333,71.0,11.1913884459499,0.7838102414493076,8236.0,,995.5636244242384
498.0,2024-01-21T17:00Z,London,,19.608302772947702,25.0,2.868010049833416,8.72553601273978,40116.0,Snow,1004.975883221545
,Unknown,London,Spring,12.281606024341688,32.0,28.343005541787175,76.11790447723033,2930.0,Storm,968.6056638670186
500.0,Unknown,London,Spring,22.28923992083259,52.0,,78.09159627061776,3822.0,Clear,1005.642670519944
501.0,2024-01-21T20:00Z,London,,37.41791947177617,67.0,18.769869960197145,29.10847037045049,8523.0,Clear,960.5884911005494
502.0,2099-13-40 25:61,,Summer,12.776610838738506,86.0,27.775108296714045,34.571758940751096,9366.0,Clear,1049.0442973320578
503.0,2099-13-40 25:61,,Spring,18.44376406980383,54.0,28.3420091472087,72.15978497602765,7834.0,Fog,1007.8934777760636
504.0,Unknown,London,Winter,12.797025998648163,37.0,,73.1460883647456,4022.0,Snow,992.1569424093195
,,,Spring,19.395143123800516,26.0,6.446882567617488,58.556774916859176,8630.0,Snow,1006.6679367849031
506.0,2024-01-22T01:00Z,,Summer,20.860892035301962,71.0,5.5599144070775175,28.205150780983814,7008.0,Clear,1012.1302466244568
507.0,2024-01-22 02:00,,,-23.442093439118082,96.0,2.8229394345654777,219.37368179169496,910.0,Storm,981.4158572930558
508.0,,London,,12.611092931642192,55.0,29.6515416724393,64.21836082629,818.0,Clear,1000.4420062413977
509.0,2024-01-22 04:00,,Winter,5.768862614097726,27.0,22.929939911438076,4.742849643951681,4547.0,,1009.7470766270587
510.0,22/01/2024 05AM,,,12.860937688926274,85.0,5.780426834010735,79.38886819196814,3810.0,Snow,1017.0181775484034
511.0,22/01/2024 06AM,London,Autumn,18.678312933587442,64.0,27.38534997644872,9.782989046478896,8996.0,,1009.8559750982682
512.0,2024-01-22T07:00Z,,,16.676891801057284,92.0,7.673440376093316,77.3774746293048,41682.0,Rain,967.230536993959
513.0,22/01/2024 08AM,London,Autumn,9.641274104213768,40.0,11.872839588509134,56.991244575345505,6240.0,Clear,998.0829993156273
514.0,2024-01-22T09:00Z,London,Winter,15.173287713196977,85.0,24.104217776799864,16.203777798474476,1977.0,Snow,974.7667551554125
515.0,2099-13-40 25:61,,Summer,20.456558220957007,22.0,2.993331137409693,41.70062891763949,6173.0,,1045.0461064817596
516.0,2099-13-40 25:61,London,Spring,,83.0,84.6161903876993,13.584303689285004,,Storm,1040.46713474303
517.0,2024-01-22T12:00Z,,Winter,22.536281779454157,57.0,6.897717844440829,7.206566919630886,5831.0,Clear,1028.2204639431882
518.0,Unknown,,Winter,6.88376054021427,68.0,15.516369529525043,11.552216511202733,6905.0,Snow,1032.0858512189388
519.0,2024-01-22 14:00,London,,40.50069050395205,52.0,7.721291740198185,42.76913236559026,1275.0,Snow,986.10907427187
520.0,2024-01-22 15:00,,,23.412550655100638,115.0,15.27278620006233,79.00584733805435,44411.0,Fog,990.2315427576467
521.0,2024-01-22 16:00,,Winter,29.055937656321536,25.0,5.045296577258899,14.13126335424404,49131.0,Clear,953.4555921042694
522.0,Unknown,,,18.31743217789298,137.0,7.737420499891908,33.47005343594961,5766.0,Storm,957.3877189322161
523.0,2024-01-22T18:00Z,London,Spring,20.991123290870178,89.0,28.031145224289872,72.04142104528285,2379.0,,1041.7043223477867
524.0,22/01/2024 07PM,,Summer,14.685022952367168,68.0,2.1045300750290052,47.56604426374045,1754.0,Clear,969.0444673951206
525.0,22/01/2024 08PM,London,Winter,8.086718584019469,22.0,11.541491210105661,32.07469364636897,6643.0,Snow,959.4180523371733
526.0,Unknown,London,,26.54318087413018,49.0,9.461711667928295,21.61415752650555,6416.0,Storm,1000.6955864002736
527.0,2024-01-22T22:00Z,,Autumn,8.019391537929462,31.0,17.60460634507439,59.191421849129576,567.0,,967.3434382355518
528.0,22/01/2024 11PM,London,Winter,12.405815724774303,23.0,3.259529622939572,21.03142748505496,3500.0,Snow,989.9676705939333
529.0,2024-01-23 00:00,,,16.20078357290595,,2.6536380829127513,20.27316672979051,6479.0,Fog,968.1431200033288
530.0,2099-13-40 25:61,London,Winter,4.9054294735685815,95.0,19.93820045836028,69.20272798126656,1567.0,Storm,1046.5034965052944
531.0,23/01/2024 02AM,London,Winter,10.312768076641358,83.0,24.870537567793146,45.017619617543225,7562.0,,1038.2499361543883
532.0,Unknown,London,Summer,-9.225506885943851,27.0,78.84245677983255,27.373379186156868,6210.0,Fog,1019.8864545850422
533.0,Unknown,London,Summer,14.386388028282147,,25.34194191366503,53.33715768089996,6046.0,Storm,1013.2675534697623
534.0,2024-01-23 05:00,London,Spring,12.05578066695827,57.0,26.501107085624074,4.544363767792259,5132.0,Clear,1028.7843683814747
535.0,2099-13-40 25:61,,Autumn,6.050912161187352,86.0,20.811904515780448,18.05087479817912,23631.0,Snow,1049.2810697337538
536.0,2024-01-23T07:00Z,London,Winter,7.943792138597776,92.0,26.952509110377562,76.11643382105885,489.0,Storm,1030.1540043586392
537.0,2024-01-23 08:00,,Spring,19.987681195386862,106.0,5.86355293983472,77.36430613979277,2931.0,Snow,1023.5263259568467
538.0,Unknown,London,Summer,21.508310696585504,35.0,12.428672192642765,60.506863528603496,8932.0,Fog,987.1905015181109
539.0,Unknown,,,15.35990512780712,,7.406196609782768,57.58991799967105,3440.0,Storm,970.8252043390178
540.0,2099-13-40 25:61,London,Spring,21.108711082857788,129.0,28.447748868315497,208.18297554355155,6997.0,,1047.6723885531064
541.0,2099-13-40 25:61,London,,4.991857297562484,24.0,3.9407399706442114,65.17546590198056,39814.0,Snow,1009.3865794886784
542.0,2099-13-40 25:61,London,,13.442084058682617,,0.31613974209533713,13.576433302113644,2288.0,Storm,1039.0339290071329
543.0,23/01/2024 02PM,London,Spring,-11.307693711378114,34.0,120.52209585977039,21.503880598290344,4907.0,,1026.9669287138995
544.0,Unknown,,Summer,11.975076801497952,78.0,20.06170392952257,10.509908637338006,3534.0,Clear,1024.3416965713186
545.0,23/01/2024 04PM,,Autumn,17.393044288789085,95.0,6.029116020674343,25.550967025455726,2291.0,,1011.8411500339839
546.0,Unknown,London,,18.708390838009684,94.0,29.92611734189339,,9732.0,Storm,979.2735836284518
547.0,2024-01-23 18:00,London,Winter,1.7455585378592797,28.0,17.28059336444927,73.23079022922877,2650.0,Clear,1045.7737231034441
548.0,Unknown,London,Autumn,8.497507945282758,52.0,,13.060277545162746,7405.0,Snow,1006.7324744632076
549.0,23/01/2024 08PM,,Summer,21.17761398654025,54.0,6.889571967295177,51.506075440520206,3248.0,Snow,1029.5091906847333
550.0,2099-13-40 25:61,London,Autumn,8.292658641621674,74.0,9.774336071079748,69.06737574413596,7372.0,Rain,1013.7603327930028
551.0,Unknown,,,16.37233786832017,90.0,4.668238701777416,64.5925857896965,1283.0,Rain,954.6668341252489
552.0,Unknown,,Summer,7.126825392040063,78.0,0.2557873404915356,9.564799938399204,6161.0,Snow,967.9847663803765
553.0,2024-01-24T00:00Z,,Spring,13.206366278326865,37.0,3.087463283870183,18.122704474396258,1412.0,Storm,960.6682847353879
554.0,2099-13-40 25:61,London,Spring,31.243467652622208,91.0,,23.395095891593584,5603.0,Clear,982.915166870727
555.0,24/01/2024 02AM,,Winter,10.741617622799943,33.0,20.110061553210137,67.43400258898008,3074.0,Clear,983.792103770704
556.0,2024-01-24 03:00,,,27.048813761609253,63.0,14.07443212610584,17.63011169643791,793.0,Storm,1033.1256960173364
557.0,Unknown,London,,11.118891903128088,94.0,16.78590883707338,52.204185900479814,2856.0,Snow,979.063850089911
558.0,2099-13-40 25:61,London,Autumn,5.72495850034279,28.0,,29.521084135015467,6561.0,Rain,963.8603999558669
559.0,2099-13-40 25:61,,Spring,15.606685027870865,53.0,29.67490866452717,11.676621781575065,4753.0,Snow,950.4439509605278
,Unknown,London,Spring,17.228055368247432,82.0,23.81083663454008,46.996092577426,39026.0,,1005.4431416173846
561.0,24/01/2024 08AM,,Winter,8.458312248539187,69.0,135.38558819074456,63.10976153413945,2509.0,Storm,972.2800656250738
562.0,2024-01-24 09:00,London,Summer,18.726160521570726,,28.33933648548766,192.13257808512247,6019.0,Snow,1014.1596536149592
563.0,2024-01-24 10:00,,,5.71644383023483,34.0,14.897043491952518,164.82579988158514,8053.0,Rain,1011.1995377461056
564.0,2099-13-40 25:61,,Summer,9.442746960757884,29.0,22.060629990747255,133.78987128689667,4207.0,,960.7391915335654
565.0,2024-01-24 12:00,,,22.990521891822667,64.0,,71.216504785137,2856.0,Storm,973.7265474630364
566.0,2024-01-24 13:00,,Autumn,-15.355261653440223,33.0,6.040091142863014,14.96097842791408,7317.0,Fog,
567.0,2024-01-24T14:00Z,,,53.024527399763215,72.0,94.32784782541697,67.43745391666648,593.0,,1028.5042239083486
568.0,2099-13-40 25:61,,,4.271910609954677,20.0,98.18740991984319,161.70908865832564,8658.0,Storm,1044.2923155110602
569.0,2099-13-40 25:61,London,Summer,27.95565655633144,84.0,14.985494921552963,68.76748638245562,5225.0,Rain,958.481505442175
570.0,2024-01-24T17:00Z,,Summer,-0.2925727690211879,59.0,29.511987120372396,,350.0,,950.397249046058
571.0,24/01/2024 06PM,London,Spring,18.258331327739928,70.0,27.411348198780566,9.131060689833204,243.0,Snow,1025.048523058376
572.0,2024-01-24 19:00,London,,25.070954529508718,36.0,4.966449347828142,25.070000057195124,6593.0,Fog,1033.8952146177885
573.0,2024-01-24 20:00,,Autumn,14.185820063273416,20.0,14.017790288278016,28.822927158671643,2444.0,Snow,978.5372037234733
574.0,2024-01-24 21:00,London,Autumn,18.49620537921976,148.0,16.23779032434764,3.212716456829474,9233.0,Storm,1014.5790209816745
575.0,2099-13-40 25:61,,,17.76179697504106,21.0,8.896621834386135,39.63738764584952,25469.0,Snow,1033.8243162730005
576.0,24/01/2024 11PM,London,Spring,17.688165518513685,60.0,12.744126279100046,69.83564106290954,22855.0,,976.2162571905881
577.0,2024-01-25T00:00Z,London,Spring,12.622022010904889,57.0,9.343697418251057,75.5969545988282,1884.0,Clear,959.1653746771029
578.0,25/01/2024 01AM,London,Spring,15.021470199997935,39.0,19.91769590547859,8.774517319526511,38522.0,Storm,1021.4420106645726
579.0,25/01/2024 02AM,,Autumn,18.950258121815533,107.0,27.195143535472248,46.215143332182905,5521.0,Clear,990.3766435796507
580.0,2099-13-40 25:61,,Spring,12.82859360299121,22.0,7.028567510925079,3.9401584245412202,8153.0,Snow,967.379124769555
581.0,Unknown,,Winter,6.539403493972207,20.0,27.272923665237908,7.622110256895951,8242.0,Clear,995.3111008879434
582.0,Unknown,,Spring,3.8390028598392156,86.0,6.416550680026065,45.94864831155829,4657.0,Snow,961.3733019619523
583.0,2024-01-25 06:00,London,Summer,7.198430705388959,65.0,0.061033809725169474,45.14560317396206,5638.0,Snow,1027.0005902995445
584.0,25/01/2024 07AM,London,Spring,24.17461869581163,26.0,18.32720970441325,25.238059496454266,1254.0,,1008.3221187587849
585.0,Unknown,London,Winter,19.511650225791737,31.0,59.51954191370764,79.73617426809878,4150.0,Rain,1038.2558691188174
586.0,2099-13-40 25:61,,Summer,17.45225512519167,28.0,19.51335028982125,15.672274443484211,2569.0,Clear,962.6117659252707
587.0,Unknown,,,24.884571892469932,,4.878360464777892,245.90152131659823,614.0,Snow,959.4577125056034
588.0,2024-01-25T11:00Z,,Spring,1.1654899793656295,73.0,14.605597208776242,28.101087100511215,4253.0,,1039.1148825696407
589.0,,,,33.47653118344131,38.0,3.967679548612084,32.45809774242816,3390.0,Clear,1026.3267037412124
590.0,2024-01-25T13:00Z,London,Summer,12.330564950343382,,18.68842230138056,45.472616098595005,6166.0,,994.2435567012066
591.0,2024-01-25T14:00Z,London,Spring,2.687815199906396,40.0,8.933943839396608,9.966724381107248,7167.0,Rain,1006.6868684742968
592.0,2024-01-25T15:00Z,,Autumn,3.4933856160793386,57.0,22.972710566976666,69.62760290400901,32117.0,Rain,981.0533329668681
593.0,25/01/2024 04PM,,Winter,12.857872891975056,39.0,21.716400040824052,219.35069765371324,789.0,Storm,983.1874028303922
594.0,Unknown,London,Spring,17.16404961886316,83.0,24.982416472673894,116.15192948685288,1070.0,,1025.9028125640803
595.0,25/01/2024 06PM,London,Autumn,12.74233699501092,22.0,5.89723525828814,3.0170043107666,7721.0,Snow,985.1329432568759
596.0,,,Autumn,28.344880699483795,35.0,21.73827237180707,64.08629759520204,9516.0,,1030.0131158162035
597.0,2024-01-25T20:00Z,London,,19.289576975060392,62.0,102.89397133883989,,4128.0,,960.7715808233975
598.0,2024-01-25T21:00Z,London,,17.98029283317825,40.0,4.333191668201902,35.05630930503952,2189.0,Rain,1000.7310137145342
599.0,,London,Spring,8.340284054500554,81.0,24.317028804892608,53.26888547841417,8672.0,Fog,982.341118910016
600.0,2024-01-25 23:00,,Autumn,14.790043324013613,72.0,27.837290373800712,53.02238679232019,628.0,Rain,963.462207333964
601.0,2024-01-26T00:00Z,London,Autumn,15.436904485116619,66.0,106.92989661518556,59.394642562344735,6400.0,Clear,1012.7317252665589
602.0,2024-01-26T01:00Z,,Autumn,17.499650633605334,70.0,21.13094828242093,196.7712138749908,2030.0,Fog,973.6181745272802
603.0,26/01/2024 02AM,London,,4.050021492590483,59.0,28.411272697966695,57.33625272911715,2062.0,,1017.4564608185932
604.0,2024-01-26 03:00,,Spring,8.857070491126397,79.0,,13.28102484522197,1691.0,Clear,1047.8168168370873
605.0,2099-13-40 25:61,,Spring,15.314134291225614,98.0,2.893137293356535,,9914.0,Clear,974.6291282449937
606.0,2024-01-26 05:00,,Autumn,11.8325576247182,68.0,3.6202551917744596,23.23029073940515,,,981.6657700287686
607.0,2099-13-40 25:61,,Winter,10.06622778615953,89.0,19.22846436789752,41.9078357987732,8251.0,Rain,1008.3688224515288
608.0,2024-01-26 07:00,London,Spring,47.8278086460673,75.0,2.977842292371169,248.99607230559562,9617.0,Rain,1024.454238644773
609.0,2099-13-40 25:61,London,,15.003422441713285,49.0,26.300079839098423,210.08996143828676,3514.0,,968.0118645262903
610.0,Unknown,London,Summer,9.478777504351442,44.0,9.793621758887173,26.31920321877616,8393.0,,1024.9887626372977
611.0,26/01/2024 10AM,London,,30.37444200709856,49.0,3.8926564896589557,,2777.0,,968.4604362532951
612.0,2024-01-26 11:00,,Spring,-28.139865896383384,,27.67436341972867,74.8541077654494,32526.0,Storm,1000.583600350051
613.0,2024-01-26 12:00,,Summer,27.536502131104818,73.0,22.02010741473734,59.43681021770615,4318.0,,1012.0576767865751
614.0,2099-13-40 25:61,,Autumn,19.63853983994056,86.0,10.042734762616202,41.943501215056685,455.0,Rain,1042.6574521343211
615.0,2024-01-26T14:00Z,London,Spring,15.689580049576021,67.0,2.140412649004584,67.94624150166838,7412.0,,976.2902372689483
616.0,2099-13-40 25:61,,Summer,-1.6972150057824749,74.0,92.09709926320377,62.71645249934056,6887.0,Storm,1027.276257337578
617.0,2024-01-26T16:00Z,,,20.688577063212268,86.0,,69.26162401914762,6214.0,Fog,956.4679206177376
618.0,26/01/2024 05PM,London,Autumn,15.098266126638958,77.0,22.91089083328942,28.026067875497276,8737.0,Clear,1046.4364044328008
619.0,26/01/2024 06PM,,Autumn,,21.0,126.7097283044374,154.77375373314717,1794.0,Snow,963.7850353334622
620.0,2099-13-40 25:61,,Autumn,20.471557669933503,86.0,10.232006478380262,73.1035124061327,4226.0,,1010.6175157974293
621.0,26/01/2024 08PM,London,Spring,6.3106206639968345,28.0,28.633199253001013,54.248000283891116,40653.0,Snow,964.4561284588773
622.0,26/01/2024 09PM,London,Winter,11.280455253273026,-7.0,14.099105537676706,42.78750891965744,3096.0,Clear,960.6254404793223
623.0,2024-01-26T22:00Z,,,8.56917043502315,58.0,1.4167275772034726,26.2167857866731,7564.0,Fog,993.1478032278653
624.0,2024-01-26 23:00,,Autumn,16.05079827825746,63.0,110.04136796624155,63.58209761380377,8718.0,,997.2968660017725
625.0,2024-01-27T00:00Z,,,17.603251763323968,40.0,23.06436924523303,21.744276389574864,5585.0,Snow,1030.4412397586257
626.0,2099-13-40 25:61,,Spring,17.62945763820315,29.0,13.200224905772185,53.22785352995937,2500.0,Snow,950.849756123331
627.0,2024-01-27T02:00Z,London,Winter,21.977032071798263,75.0,17.145256973737297,,2427.0,Snow,996.1468293206736
628.0,2024-01-27T03:00Z,London,Summer,6.702824498813392,94.0,14.734231988593788,12.066454310704238,7487.0,,1040.1417801559576
629.0,Unknown,,Winter,7.6828322310792085,26.0,22.22948355774155,34.78167516685602,7365.0,Fog,969.406569283336
630.0,Unknown,,Winter,20.75942988501221,98.0,11.027251539193863,27.385188514250913,562.0,Clear,971.0606306470695
631.0,2024-01-27 06:00,,Autumn,25.681578929398192,52.0,14.624821400649179,113.5357535364893,5453.0,Clear,992.0250524647057
632.0,27/01/2024 07AM,,Autumn,14.332349672760742,91.0,23.00873882179939,171.79627997278897,1625.0,Clear,986.0397847620144
633.0,2024-01-27T08:00Z,,Spring,13.428069639548092,92.0,14.40207112360327,62.026978625213864,7204.0,Snow,1018.4121664273591
634.0,2099-13-40 25:61,London,Spring,17.810184098302216,88.0,52.429189762407866,122.2580475457569,39762.0,Storm,958.4816379102618
635.0,2024-01-27 10:00,London,Spring,,36.0,12.000234777322836,32.7055402761719,7870.0,,988.8243469109482
636.0,2099-13-40 25:61,London,Summer,12.229669658799796,67.0,4.4013350295309195,28.804217923048494,3930.0,Fog,994.6031336663254
637.0,2099-13-40 25:61,,Summer,,78.0,4.634009261497801,30.903520548237946,2673.0,Snow,1048.7371927058168
638.0,2099-13-40 25:61,London,Spring,26.054819997388172,95.0,10.25787804316992,70.52396627620506,9436.0,Snow,1007.3559988598909
639.0,27/01/2024 02PM,,Spring,11.56234479093376,,22.91118035666042,28.11667222280719,2238.0,Storm,965.383042868598
640.0,2024-01-27T15:00Z,London,Summer,45.866262931958005,51.0,5.218586835139037,59.466715353153475,5018.0,Rain,1026.8397372600157
641.0,2024-01-27 16:00,,Winter,22.689510484316628,27.0,2.501290833673695,4.894994729907971,4172.0,Storm,1024.4607617944666
642.0,27/01/2024 05PM,,Spring,11.043837100200243,36.0,98.47007409257651,18.024698302178876,7879.0,Clear,1010.6227815884774
643.0,Unknown,London,Summer,16.935746294489835,20.0,16.855476551429362,14.074744228406235,246.0,Storm,992.7836576389338
644.0,2024-01-27T19:00Z,London,Spring,15.29605110645411,32.0,12.646898479060035,26.93749853119062,2219.0,,989.7172483634561
645.0,27/01/2024 08PM,,Autumn,23.47590458860784,64.0,20.199298157269816,4.599467638370243,2554.0,Snow,985.1056783756923
646.0,,,Summer,9.821989459641063,59.0,23.2903434531579,17.854751736884342,2991.0,Snow,970.9486074807664
647.0,27/01/2024 10PM,London,Spring,19.54337411081955,48.0,87.78939314922468,43.66950158877436,9058.0,,1032.3108853992308
648.0,2024-01-27T23:00Z,,Summer,21.444923856287765,136.0,8.214391716905418,23.597228749405286,2151.0,Fog,981.2326393041416
649.0,2024-01-28 00:00,London,,14.8456359919272,85.0,15.966685042313486,19.938540109366542,2228.0,Fog,1028.7597398801481
650.0,Unknown,,Autumn,30.29591872773089,77.0,24.494202014925328,65.45059254978005,1149.0,Rain,966.2076566873062
651.0,2024-01-28T02:00Z,,Winter,10.009046940839635,97.0,15.00209208833995,30.420965456498827,770.0,Storm,1000.0149812576585
652.0,2099-13-40 25:61,London,Winter,45.839031522750595,103.0,,55.85754079329235,9642.0,Storm,971.9984467588617
653.0,2099-13-40 25:61,,Winter,-0.34337205494830947,38.0,29.39707329594082,16.67680039100749,3140.0,Rain,1031.1667563544663
654.0,2099-13-40 25:61,,Autumn,13.774604984545201,82.0,23.467044055207598,51.8208415858544,4633.0,Fog,1045.4657361066886
655.0,28/01/2024 06AM,London,Autumn,14.086594451221263,60.0,28.29104013591298,,611.0,Snow,995.2072945849029
656.0,2024-01-28 07:00,,Summer,,77.0,14.223024203637916,55.184825184201316,8301.0,Storm,991.5835247542378
657.0,2024-01-28 08:00,London,Summer,13.865513742253507,86.0,29.008060728631527,11.836957507801706,7984.0,,971.9675892261506
658.0,28/01/2024 09AM,,Spring,18.90640569052384,51.0,4.843834522714515,,5766.0,Snow,1003.6981249098925
659.0,28/01/2024 10AM,London,Autumn,10.845472320818871,40.0,24.317395209913865,47.69323770270696,6359.0,Fog,993.3103216070632
660.0,Unknown,London,Summer,10.936919070295245,75.0,6.178398951408365,53.05914064246701,6785.0,Fog,956.2957027104934
661.0,2024-01-28 12:00,,Summer,50.63393039064852,33.0,23.62995960301949,125.66328821262621,1660.0,Fog,1009.4170307551061
662.0,2099-13-40 25:61,,Spring,21.055016566609474,43.0,3.2665577842158786,117.82131520448169,8672.0,,1019.992241081354
663.0,,London,Summer,12.805024600923693,77.0,,216.5606889566052,9586.0,Rain,1019.9011205334203
664.0,2099-13-40 25:61,London,,,46.0,69.05733342176276,0.19969161366105048,9329.0,Snow,1049.1290960671224
665.0,2024-01-28T16:00Z,London,Summer,2.8680728635867077,41.0,18.64880022746261,115.49286349824804,1009.0,Clear,1013.0396039158826
666.0,28/01/2024 05PM,,Summer,13.47179698937705,21.0,20.886881491825456,168.30670713393988,4137.0,,999.3659768608524
667.0,2024-01-28 18:00,,Autumn,10.89223007308214,24.0,23.373799664324263,70.87260922434331,1023.0,Rain,992.5103852481647
668.0,28/01/2024 07PM,London,Autumn,-8.441967048711561,57.0,15.262997010972558,67.42691881087885,29290.0,Clear,1008.6290208315144
669.0,2099-13-40 25:61,London,Spring,24.154425044795197,67.0,127.52323256008951,25.851701214208767,5462.0,,952.1272864134387
670.0,2099-13-40 25:61,,,16.488255173204163,30.0,,242.63448397499326,3978.0,Rain,955.4457401368097
671.0,2024-01-28 22:00,London,Autumn,-27.073317451932546,31.0,5.582399900237799,53.34221330251144,3912.0,Snow,994.9194937403624
672.0,2099-13-40 25:61,,,6.659054364209009,44.0,9.494145051297231,35.55223854730632,2912.0,Fog,993.9976682241024
673.0,29/01/2024 12AM,,Autumn,19.821228197933014,98.0,22.231295225815934,10.697315996715107,1044.0,Snow,978.1171525752867
674.0,Unknown,London,Autumn,11.65766140160369,46.0,4.441553330331718,71.61496350112684,2625.0,Snow,989.7886133761667
675.0,29/01/2024 02AM,,Summer,-1.2313964420634989,53.0,13.102996254585591,70.47277741097639,5285.0,Snow,1034.9527972413534
,2024-01-29 03:00,London,Spring,11.630369114405969,26.0,29.22073564156764,21.037247309965377,1249.0,Storm,
677.0,2024-01-29T04:00Z,,,20.708429768063276,56.0,133.28345415029816,13.561270370028815,8716.0,Snow,986.0356254367294
678.0,2024-01-29T05:00Z,,Summer,41.3423587085548,29.0,11.680440816138693,54.86428309389489,6913.0,Snow,1038.9220569496738
679.0,2024-01-29T06:00Z,,,0.1981519936253875,70.0,22.975497642666486,71.07385553103299,49746.0,Snow,1045.23568340861
680.0,2024-01-29 07:00,,Autumn,32.22478800828753,57.0,21.212521574578673,74.05000732389243,6256.0,Storm,957.0729909638136
681.0,2024-01-29 08:00,London,Summer,17.244541372513712,59.0,26.149674155033438,53.97177128791414,33840.0,Clear,1038.8642456129096
682.0,2024-01-29T09:00Z,London,Autumn,17.824895298996495,31.0,16.909705549920712,72.40443584615959,43786.0,Storm,979.2570881749764
683.0,2024-01-29T10:00Z,London,Spring,21.946416001825988,45.0,29.368206456549846,0.7858078731736562,32148.0,Fog,1002.7483507038628
684.0,2024-01-29 11:00,London,Spring,-2.0909529090730956,36.0,10.765657667402678,76.43653445313733,5456.0,Rain,1022.0648339056826
685.0,2024-01-29 12:00,London,Summer,47.20498379265294,137.0,116.82262476017684,34.48263844982761,48656.0,Rain,1007.1745504898333
686.0,2099-13-40 25:61,London,Summer,10.738621905867817,84.0,22.84394106541076,31.25623066925882,5440.0,Storm,1045.6137846394274
687.0,Unknown,London,,26.06384348557661,73.0,20.634559377073696,46.54447666258068,1172.0,Storm,1019.1506300163026
688.0,29/01/2024 03PM,London,Autumn,24.27484066664165,96.0,120.38655198841491,156.39444184451577,30084.0,Fog,984.2566339950324
689.0,Unknown,,Autumn,49.441745500257895,69.0,11.315894266255023,75.52890098680547,9221.0,Storm,1012.7010114982186
690.0,2099-13-40 25:61,,Winter,19.41157891225649,122.0,22.691119050751354,17.158140693103476,,Fog,987.3200013713362
691.0,29/01/2024 06PM,,Spring,18.83957501731815,74.0,22.65911337355556,137.4320317555792,5809.0,Storm,962.3858566846048
692.0,2024-01-29T19:00Z,London,Winter,12.278258373630047,31.0,9.181920478309499,78.38045127692003,6619.0,Storm,1035.3694850756613
693.0,2099-13-40 25:61,London,Summer,,82.0,24.847849773169077,6.675283102031111,7119.0,Rain,992.4163340206333
694.0,29/01/2024 09PM,,,20.519249005311067,59.0,11.463796021427857,,9431.0,Storm,1026.4622733872216
695.0,2099-13-40 25:61,,Summer,25.6007745745543,53.0,3.2319291202979192,51.05709240418414,8363.0,Clear,1015.9059838966838
696.0,Unknown,,Winter,18.963858313673974,88.0,,18.220458702730333,7468.0,Snow,955.2256413411282
697.0,30/01/2024 12AM,,Winter,16.483213636332653,95.0,10.599845979177799,77.5143958544499,5772.0,Rain,1005.4725667760367
698.0,2099-13-40 25:61,London,Autumn,22.898980850470938,37.0,8.296532468038574,244.90397644155615,3003.0,Fog,1036.8254734750617
699.0,2024-01-30T02:00Z,,Summer,15.43595897821696,86.0,20.757912526233653,43.718450803280874,42396.0,,973.8078731016103
700.0,2024-01-30 03:00,London,,20.259265217835438,64.0,22.411357133715956,60.943591156397986,3192.0,Snow,1005.0165484312279
701.0,2024-01-30 04:00,,Winter,11.319930611913112,66.0,9.475695907275398,21.877380811656188,20207.0,Snow,951.8072838424467
702.0,2024-01-30 05:00,,Winter,12.619660618808133,,17.280630170490095,55.08772670358415,9492.0,Rain,1007.6883843681106
703.0,2024-01-30 06:00,,Summer,9.994123790075527,28.0,0.05660920208079512,34.56063511750109,3492.0,Fog,1049.164227692679
704.0,2099-13-40 25:61,,,,24.0,6.101457792094001,43.544597156593746,1127.0,Snow,985.3761921529305
,2024-01-30 08:00,London,Winter,18.342735629728153,42.0,21.499716203379723,55.98291058787791,2911.0,Fog,952.5595888081514
706.0,Unknown,London,Summer,13.059812445789813,80.0,12.929606627873117,59.03776631108627,,,1017.7272581898179
707.0,30/01/2024 10AM,,Spring,11.66235205818582,65.0,21.11605370073585,30.714521313364784,9102.0,Clear,986.5307124864523
708.0,2024-01-30T11:00Z,,Autumn,6.110045371691509,50.0,4.935035016710394,19.813865391205372,5798.0,Clear,1044.2168938616555
709.0,2024-01-30T12:00Z,,,-3.112133670542832,84.0,3.55455035977677,108.67155949496646,3419.0,Rain,1036.6924981865716
710.0,2024-01-30T13:00Z,,Winter,18.67945549238947,78.0,11.342877851597118,41.843270452343404,4365.0,Fog,1031.008224721874
711.0,2024-01-30T14:00Z,,,4.48938260407682,59.0,135.29759916155703,68.24658043116085,6055.0,Clear,1048.2335690906466
712.0,Unknown,London,,19.60867916958488,98.0,19.44441814212105,48.55553213228799,8242.0,Storm,1005.6870367419262
713.0,2099-13-40 25:61,London,Winter,14.518121118473768,56.0,18.810640120211687,77.46497017814546,155.0,Storm,982.9404146519685
714.0,2024-01-30 17:00,,Autumn,6.172591051327883,40.0,21.32637992060332,38.58217094081964,4214.0,Rain,999.7881592045252
715.0,2024-01-30 18:00,London,,31.129474322786297,64.0,20.75580376815648,56.04059541435788,3490.0,Snow,967.1296338223652
716.0,2099-13-40 25:61,,Winter,25.104313315182743,71.0,26.839352370025324,66.75480287885152,2356.0,,1034.845489371074
717.0,30/01/2024 08PM,,Autumn,14.05972933092904,52.0,3.580386166503773,71.08404508192086,5305.0,Snow,1019.6466888129067
718.0,2099-13-40 25:61,,Summer,-8.936454566299563,36.0,11.355730282423039,20.94944804631851,4910.0,,972.6864881280644
719.0,30/01/2024 10PM,,Autumn,45.1520229454918,64.0,15.512434066966614,38.59437297183358,732.0,Clear,956.4495351184687
,2024-01-30 23:00,,Winter,4.975851899558084,36.0,23.443671903024025,222.49379377555198,1370.0,Storm,1035.0001738607937
721.0,Unknown,London,Spring,9.638477276634966,24.0,26.09922193583002,67.97370298546349,5500.0,,950.9424709796488
722.0,2024-01-31 01:00,London,Summer,-2.6355268045127573,47.0,16.39189244218197,45.33725105761414,39626.0,Snow,1006.4102458732362
723.0,2099-13-40 25:61,,Winter,3.030928252794995,72.0,4.601440776139841,20.108857232866512,7688.0,Clear,1012.964093861924
724.0,2024-01-31T03:00Z,,Winter,,25.0,18.560381119547873,5.567408276359602,8154.0,Snow,1037.684223392526
725.0,31/01/2024 04AM,London,Summer,-1.1652314332345455,62.0,0.06117329133872862,75.63538569989392,7615.0,Snow,995.7285822613569
726.0,2024-01-31T05:00Z,London,,-16.567545257768586,69.0,6.583223621666075,67.41850940360473,5758.0,Clear,1009.721326004075
727.0,31/01/2024 06AM,London,,-13.542228508341662,55.0,23.694067449546274,65.18258352523266,5303.0,Rain,960.518364639799
728.0,31/01/2024 07AM,,Summer,16.063143090098084,73.0,,54.28222036085296,43711.0,Fog,1004.7714415048897
729.0,Unknown,London,Autumn,19.19459571304134,48.0,2.788900173379166,37.15268820143371,9919.0,,1015.3175205739657
,2024-01-31T09:00Z,,Winter,-0.30105474922815567,73.0,22.65788340880885,28.125946017530026,5810.0,,983.3765154006417
731.0,2099-13-40 25:61,London,Summer,0.9763871578987828,50.0,22.6697672989584,11.683002157445639,4948.0,Snow,1048.3503936871246
732.0,2024-01-31 11:00,London,,11.481164999256524,36.0,15.930504075288727,24.878487758670033,46522.0,Storm,1040.0508993610213
733.0,Unknown,,Spring,5.868911923137977,81.0,18.428726561926645,62.58602356011738,32982.0,Storm,1018.6914078686531
734.0,2024-01-31T13:00Z,London,Spring,3.9171063173960086,97.0,25.915110303488785,7.300259146288495,,Clear,979.8214949014579
735.0,31/01/2024 02PM,,Autumn,7.759358649069313,84.0,17.935835383113982,219.76214455916733,3608.0,Rain,1042.3775319113047
736.0,Unknown,,Winter,-29.595522867739064,60.0,22.20188021434987,9.513616937164384,1225.0,Fog,980.1331381735179
737.0,2024-01-31T16:00Z,London,Spring,11.938779777521322,-7.0,29.812795339358694,20.45210492173016,7845.0,Clear,960.291917770705
738.0,Unknown,,Winter,4.244270605192895,98.0,29.49900823743013,34.021074472051325,1130.0,Snow,985.3389055876809
739.0,31/01/2024 06PM,,,19.111922358519205,38.0,20.722437095002576,78.62940748333298,9068.0,Storm,991.0438047107195
740.0,31/01/2024 07PM,,Autumn,47.83643828941077,41.0,20.76099086010267,2.3834003592984754,3024.0,Clear,1043.2994217830642
741.0,Unknown,London,,8.028595143018578,26.0,15.186822181763315,43.46904015655578,9672.0,Fog,979.377727876999
742.0,2024-01-31T21:00Z,London,Summer,17.99355351196934,29.0,8.873071770876457,60.35328021904425,30929.0,Snow,976.0246959969012
743.0,31/01/2024 10PM,,Summer,-16.235275397345156,30.0,18.16027546974296,71.57045975484263,1864.0,,1007.0688401344972
744.0,2024-01-31 23:00,,,-11.34266276578164,79.0,15.143812342258688,5.475473030437419,1210.0,Fog,999.3520698997484
745.0,Unknown,London,Summer,2.325945341709094,98.0,85.20977413065792,32.800214282385255,,Fog,987.6391458546035
746.0,2099-13-40 25:61,London,Winter,20.210663501906915,92.0,9.017257767180546,53.02843658075009,1497.0,Rain,994.0458808465294
747.0,01/02/2024 02AM,,Winter,27.57009433404786,47.0,27.983485482464612,4.818835432872461,726.0,Fog,
748.0,01/02/2024 03AM,London,Summer,8.115615127491388,62.0,1.574249457152358,35.76910280275271,1395.0,Storm,994.8801043046835
749.0,2099-13-40 25:61,London,,-13.004360620594724,80.0,24.22152703748565,8.277422590701544,3275.0,Rain,968.9435736177421
750.0,2024-02-01 05:00,,Winter,18.155420470170302,63.0,17.876978590111687,63.51714594619512,26475.0,Clear,972.6906741174415
751.0,2024-02-01T06:00Z,,Winter,16.3820408495887,30.0,16.617868593934656,26.967344473501136,864.0,Fog,1004.8280970133688
752.0,01/02/2024 07AM,,Summer,18.500276930196478,94.0,20.09881447508638,17.593611084087204,3746.0,Rain,1045.482860162911
753.0,2024-02-01T08:00Z,London,,-26.155606642490095,26.0,29.216217048020507,0.9316289732408389,3148.0,Clear,1046.865807674016
754.0,,London,Summer,13.938299565328904,26.0,24.39387529528136,131.3203539258915,6513.0,Fog,997.836130684266
755.0,2024-02-01T10:00Z,London,Winter,20.092367511943294,96.0,86.66660756501368,248.870330635002,8874.0,Storm,1020.8792091497828
756.0,01/02/2024 11AM,,Spring,19.59992065532125,41.0,24.37046431246409,34.98378707394068,492.0,,1042.7790648274006
757.0,2024-02-01T12:00Z,London,Spring,21.824255995544476,78.0,81.66665933982759,77.68662314563856,5534.0,Clear,986.3063459696224
758.0,2024-02-01T13:00Z,,Summer,10.124690725674988,33.0,9.663453558956851,6.052348125493614,6580.0,Storm,973.9825500048427
759.0,01/02/2024 02PM,,,47.83007089769292,98.0,16.046715631543794,40.84325728074462,6289.0,,956.3430164441959
760.0,2024-02-01 15:00,,Summer,18.87619605414572,92.0,8.562544372025837,37.49121556595347,7533.0,Storm,992.2850871409594
761.0,2099-13-40 25:61,,Autumn,-27.048981001193525,114.0,,52.19725295984447,9319.0,,1009.5839120214732
762.0,,London,,13.890823410333203,75.0,,28.774933917762453,7960.0,Snow,1024.5911151917953
763.0,01/02/2024 06PM,London,Autumn,10.539712080025662,32.0,1.7746011447178789,152.0398053699076,6131.0,Clear,951.3709085025868
764.0,2024-02-01 19:00,,Winter,5.12259390752933,20.0,2.1784696832774775,61.24838780200975,7811.0,Fog,1000.0621785438028
765.0,2024-02-01T20:00Z,London,,6.475724087286048,99.0,148.96648718829198,75.88764628777163,1651.0,Rain,980.8688235660919
766.0,2024-02-01 21:00,,Winter,18.179250372472865,64.0,27.567577606331575,184.72410051516772,22637.0,,984.9087566462425
767.0,2024-02-01 22:00,London,,19.763038823977357,22.0,4.364451195371537,49.62272399689917,7932.0,Rain,1027.0203259184748
768.0,2024-02-01T23:00Z,London,,16.548844988375215,69.0,14.927682423652609,14.107201839151733,5290.0,Fog,1009.5189914377198
769.0,2024-02-02T00:00Z,London,Winter,18.968609330709878,40.0,2.2263715009965734,46.981912191846874,,Rain,971.0973332771013
770.0,2024-02-02T01:00Z,London,Winter,15.049921239276257,84.0,29.617958214706043,121.51923842116406,4309.0,Fog,1024.2981308944723
771.0,02/02/2024 02AM,London,Spring,10.826484471562502,32.0,15.25024231603464,23.13478711389851,,Fog,1035.6619144384028
772.0,02/02/2024 03AM,,Spring,17.313834376271483,86.0,20.415780109849614,0.6193578223467178,2492.0,,966.565073922652
,02/02/2024 04AM,London,Autumn,46.75203947852865,83.0,7.684447576059867,35.82880789466689,1438.0,,970.9943259571127
774.0,2099-13-40 25:61,London,Autumn,13.280206271542065,63.0,25.436742571473026,58.14442580665961,6574.0,Fog,995.80664219413
775.0,02/02/2024 06AM,London,Autumn,13.510591778147822,94.0,6.432054304426453,12.189852309742122,8467.0,Snow,1007.2844574423656
776.0,2099-13-40 25:61,London,Winter,6.219848379151376,84.0,3.8809278183066995,14.941207803156011,1546.0,Storm,965.791583657885
777.0,2024-02-02T08:00Z,London,Spring,5.294595787277949,51.0,28.686802328410096,2.693303982592008,33000.0,,979.9861412347418
778.0,2024-02-02T09:00Z,London,Spring,1.975192250491478,56.0,27.343308839844415,33.75042214139172,38294.0,Clear,1048.5733825867799
779.0,2024-02-02 10:00,,Summer,21.82351239765279,98.0,61.211706200645864,29.09578748958772,6842.0,Rain,1044.5076074019455
780.0,2024-02-02 11:00,,Summer,24.765391955290077,30.0,14.486346033939625,56.94612981610418,5150.0,Storm,990.7189077476837
781.0,2024-02-02T12:00Z,London,Spring,16.687226503557895,68.0,26.813836401877726,2.3071013822649356,1241.0,Fog,1014.3031561897301
782.0,,London,Spring,16.304925510303896,97.0,81.70590599096414,57.39334017931207,1791.0,Clear,987.9784058525252
783.0,02/02/2024 02PM,London,Winter,11.276122213155233,76.0,27.249127736930696,57.862919100363044,5092.0,Snow,1033.5985102817808
784.0,2024-02-02T15:00Z,,Autumn,20.072103387553963,38.0,4.98868758560849,16.47752405363927,1308.0,Fog,1009.5251385794766
785.0,2099-13-40 25:61,,,20.809196974302832,88.0,3.181457165319963,65.96855718700235,8729.0,Clear,1002.3448949046417
786.0,02/02/2024 05PM,,,19.655725306187428,42.0,1.4336171387820795,63.99790952909313,9105.0,Snow,989.86774955604
787.0,02/02/2024 06PM,,Autumn,9.514525683007399,61.0,6.859365906808187,68.06114526960968,6283.0,Snow,987.9091517301987
788.0,2024-02-02T19:00Z,London,,11.873335515478914,72.0,9.802675490811358,179.90741729608212,1354.0,Fog,1003.52709373777
789.0,02/02/2024 08PM,,Spring,15.592077544617105,81.0,12.765660678071248,40.917567623167336,8093.0,Snow,1013.5757057840021
790.0,2024-02-02 21:00,London,Winter,14.566298768087274,52.0,27.128777026670058,9.169093254696312,39255.0,Fog,953.7720841205045
791.0,2099-13-40 25:61,London,,23.835535959927917,57.0,15.923089014692914,59.70470837276166,3911.0,Storm,1033.9064931698215
792.0,02/02/2024 11PM,,Autumn,21.785901967965835,78.0,12.926725683301745,244.6407989406314,9437.0,Clear,1002.513831701141
793.0,2024-02-03 00:00,,Spring,19.288310435410157,90.0,106.16490982425836,50.58938509317106,5298.0,Storm,963.9749815746352
794.0,2024-02-03T01:00Z,London,Autumn,10.682259877507711,74.0,29.548876810046583,32.22821888776739,7597.0,Rain,997.1204162115981
795.0,2099-13-40 25:61,,Autumn,19.353521722978662,135.0,19.48600224343389,30.136727517086204,3454.0,Rain,962.184382798368
796.0,Unknown,London,,24.231751430940925,27.0,12.799868956239303,247.2127067665589,2092.0,,954.7548171082127
797.0,2099-13-40 25:61,,Summer,51.67065080949506,103.0,114.04632499787539,73.19093088568772,7350.0,Clear,988.0970394570714
798.0,2024-02-03T05:00Z,London,Winter,50.98743193786682,27.0,19.48316482256058,6.004176787271165,7123.0,Rain,1044.045668143645
799.0,Unknown,,,10.01975905447098,65.0,11.896079460827526,57.3439229983361,5855.0,Snow,963.2074011069814
800.0,2024-02-03T07:00Z,London,Spring,12.39680821546177,147.0,29.868511031431588,2.823402884953694,1178.0,Snow,976.1018216343012
801.0,2099-13-40 25:61,,Winter,11.008819392046702,43.0,11.692401217148616,16.61178666467788,7888.0,Clear,1039.1579446408657
802.0,2099-13-40 25:61,,Autumn,7.532090366216623,60.0,25.68048651630648,,9048.0,Rain,972.1905145342233
803.0,2024-02-03 10:00,,Spring,34.455487897955365,30.0,,190.1298968289824,6392.0,Fog,992.512147553846
,2099-13-40 25:61,London,,16.012756286821098,58.0,26.962000090104326,57.85491801413375,3657.0,Storm,1032.66040819722
805.0,2024-02-03 12:00,London,Summer,4.90514491956913,40.0,7.011959698031082,73.42329926361303,945.0,,957.4832257367411
806.0,2099-13-40 25:61,London,Spring,17.019822008002926,61.0,17.009131258772467,,9804.0,Snow,1036.8386001811523
807.0,Unknown,London,,21.375309038931388,24.0,15.028501217732366,54.23293518139832,3290.0,Snow,987.1587930182563
808.0,03/02/2024 03PM,London,Winter,32.608562784642274,33.0,10.728838896331675,229.09410806287602,2631.0,Fog,979.9230934441388
809.0,2099-13-40 25:61,London,Autumn,-0.47888731351849856,61.0,7.04116883318119,60.339285567808204,1009.0,,974.9864250818794
810.0,2099-13-40 25:61,,Summer,21.2794701370096,83.0,9.329727574226851,19.13611853020476,43974.0,Fog,970.6346641495119
811.0,Unknown,,Winter,19.39040780746959,85.0,8.511875854429935,18.025986741197364,8741.0,Snow,1006.8061416173731
812.0,2024-02-03T19:00Z,London,,5.913004681424022,36.0,21.43613535009809,51.506121119866314,7060.0,Clear,1041.4927212616658
813.0,2099-13-40 25:61,,Autumn,27.507321097148875,98.0,,56.15495618401126,7607.0,,950.286811113304
814.0,03/02/2024 09PM,London,Winter,19.93023586516902,34.0,25.377887461033815,43.19229805946182,832.0,Rain,954.6787998542744
815.0,2024-02-03T22:00Z,London,,18.848558683142503,98.0,12.677140055103393,21.148609627576693,8758.0,Snow,999.591805298473
816.0,2024-02-03 23:00,London,Summer,14.965228473764792,73.0,10.009368573645322,64.86063718922365,,Storm,1024.8190762266534
817.0,2024-02-04T00:00Z,,,5.464620303080716,47.0,9.908003340779091,79.59028893828362,3086.0,Snow,1003.8176953282443
818.0,2024-02-04 01:00,,Winter,28.302831142775545,66.0,0.4093998481896166,38.63933376958049,1808.0,Fog,1019.5571651773399
819.0,Unknown,,Winter,33.27133236410381,55.0,7.729902716812992,,31236.0,Clear,1046.355814930982
820.0,2099-13-40 25:61,,Spring,16.97252695526886,41.0,15.092536155285895,27.232539846511976,1601.0,Fog,994.0979306817482
821.0,04/02/2024 04AM,,,-10.591945179318422,49.0,12.133100379235936,4.554593150257746,40514.0,Storm,989.193701003262
822.0,04/02/2024 05AM,London,Autumn,20.509564092551656,77.0,0.562961459881498,208.8249704295515,3068.0,Snow,1013.6557673580174
823.0,Unknown,London,Autumn,11.024238323737055,35.0,29.48234857794282,43.014844835431916,4186.0,Clear,967.137768313453
824.0,Unknown,,Summer,4.520927666264836,52.0,81.32777544462874,19.831266649757726,30336.0,Rain,1005.9518543502472
825.0,2024-02-04T08:00Z,,Winter,2.8363912202436588,87.0,4.2768195448478,78.99873061175656,2239.0,Storm,963.5930291219069
826.0,04/02/2024 09AM,,Summer,20.022891027440323,94.0,29.136705728724202,15.82387764854614,9712.0,Rain,950.938724034388
827.0,2024-02-04T10:00Z,,,-1.9522021167318862,61.0,1.8596120694444662,25.76020296838894,6898.0,Clear,1014.2684055771209
828.0,,,,-1.84755937124989,88.0,3.8725817444144504,29.072419590097212,4616.0,,1005.1396804676237
829.0,2099-13-40 25:61,London,Spring,5.086307238395678,91.0,25.87764976946259,43.93157235445497,3351.0,Rain,975.6859942094318
830.0,2024-02-04T13:00Z,,,-12.254597099566105,61.0,27.390327422460434,44.84073510052022,3952.0,Fog,961.6867407416903
831.0,2099-13-40 25:61,,,7.684455447337938,78.0,12.468754065501905,16.29496679907856,9217.0,,984.3401008683632
832.0,04/02/2024 03PM,,,15.868427550343656,73.0,67.27262027528448,42.031351731640534,6521.0,Clear,981.0894274354539
833.0,2024-02-04 16:00,,Spring,3.591058098075216,90.0,8.131525774985356,16.76870064511979,756.0,Storm,
834.0,Unknown,London,Autumn,23.07667354722374,75.0,25.652080803494254,75.51157666136056,1804.0,,1016.508527611907
835.0,2024-02-04 18:00,,Winter,-1.4154953721160979,41.0,8.232602023287887,72.90093319182452,2719.0,Storm,1029.0822570748846
836.0,2099-13-40 25:61,,Autumn,16.445778351138348,38.0,2.760252192942102,2.52427542845842,3342.0,Fog,1038.5009410391258
837.0,Unknown,,Autumn,16.779470796828168,28.0,11.243295946045917,27.356298166479593,4102.0,Storm,958.1535864341877
838.0,2024-02-04T21:00Z,London,Spring,16.77988452928728,25.0,2.8321263943295136,73.91896789155196,8864.0,Storm,1012.376564995301
839.0,2099-13-40 25:61,London,Summer,13.132061932928885,73.0,20.39355097365108,200.67197862987143,3423.0,Fog,954.5540710534489
840.0,Unknown,,Summer,10.309728269488245,30.0,0.17182265514326112,30.698578339669027,3513.0,Rain,1013.4640108391496
841.0,05/02/2024 12AM,London,Summer,25.276853130780857,60.0,63.46188490252213,64.1256226942194,6989.0,Storm,988.7964468733959
842.0,2024-02-05 01:00,London,Summer,9.06638383528799,31.0,1.7524410246633226,13.596543221579624,2313.0,,993.4441691239343
843.0,2099-13-40 25:61,London,,11.71080411676659,80.0,16.470974108567496,58.41589088373162,7144.0,Fog,1018.3653893528561
